tag,count,href,category
Peppermint Cookie (Cookie Run),109,/tags/Peppermint%20Cookie%20(Cookie%20Run),c
Wizard Cookie (Cookie Run),385,/tags/Wizard%20Cookie%20(Cookie%20Run),c
Herb Cookie/Roll Cake Cookie (Cookie Run),1,/tags/Herb%20Cookie*s*Roll%20Cake%20Cookie%20(Cookie%20Run),r
Pancake Cookie (Cookie Run),150,/tags/Pancake%20Cookie%20(Cookie%20Run),c
Roll Cake Cookie (Cookie Run),77,/tags/Roll%20Cake%20Cookie%20(Cookie%20Run),c
Herb Cookie (Cookie Run),684,/tags/Herb%20Cookie%20(Cookie%20Run),c
Cinnamon Cookie (Cookie Run),72,/tags/Cinnamon%20Cookie%20(Cookie%20Run),c
Coffee Cookie (Cookie Run),12,/tags/Coffee%20Cookie%20(Cookie%20Run),c
Apple Cookie (Cookie Run),39,/tags/Apple%20Cookie%20(Cookie%20Run),c
Cotton Candy Cookie (Cookie Run),70,/tags/Cotton%20Candy%20Cookie%20(Cookie%20Run),c
Orange Cookie (Cookie Run),43,/tags/Orange%20Cookie%20(Cookie%20Run),c
Lime Cookie (Cookie Run),43,/tags/Lime%20Cookie%20(Cookie%20Run),c
Cloud Cookie (Cookie Run),4,/tags/Cloud%20Cookie%20(Cookie%20Run),c
Mint Choco Cookie (Cookie Run),377,/tags/Mint%20Choco%20Cookie%20(Cookie%20Run),c
Rockstar Cookie (Cookie Run),114,/tags/Rockstar%20Cookie%20(Cookie%20Run),c
Snow Sugar Cookie (Cookie Run),84,/tags/Snow%20Sugar%20Cookie%20(Cookie%20Run),c
The Witch (Cookie Run),21,/tags/The%20Witch%20(Cookie%20Run),c
Dark Choco Cookie/Whipped Cream Cookie (Cookie Run),46,/tags/Dark%20Choco%20Cookie*s*Whipped%20Cream%20Cookie%20(Cookie%20Run),r
Wind Archer Cookie (Cookie Run),244,/tags/Wind%20Archer%20Cookie%20(Cookie%20Run),c
Dark Choco Cookie (Cookie Run),1117,/tags/Dark%20Choco%20Cookie%20(Cookie%20Run),c
Vampire Cookie (Cookie Run),538,/tags/Vampire%20Cookie%20(Cookie%20Run),c
Cherry Blossom Cookie (Cookie Run),126,/tags/Cherry%20Blossom%20Cookie%20(Cookie%20Run),c
Hero Cookie (Cookie Run),75,/tags/Hero%20Cookie%20(Cookie%20Run),c
Whipped Cream Cookie (Cookie Run),101,/tags/Whipped%20Cream%20Cookie%20(Cookie%20Run),c
Princess Cookie (Cookie Run),246,/tags/Princess%20Cookie%20(Cookie%20Run),c
Pistachio Cookie (Cookie Run),49,/tags/Pistachio%20Cookie%20(Cookie%20Run),c
White Choco Cookie (Cookie Run),65,/tags/White%20Choco%20Cookie%20(Cookie%20Run),c
Knight Cookie (Cookie Run),334,/tags/Knight%20Cookie%20(Cookie%20Run),c
Dark Enchantress Cookie (Cookie Run),575,/tags/Dark%20Enchantress%20Cookie%20(Cookie%20Run),c
Fire Spirit Cookie (Cookie Run),273,/tags/Fire%20Spirit%20Cookie%20(Cookie%20Run),c
Sea Fairy Cookie (Cookie Run),345,/tags/Sea%20Fairy%20Cookie%20(Cookie%20Run),c
Moonlight Cookie (Cookie Run),294,/tags/Moonlight%20Cookie%20(Cookie%20Run),c
Angel Cookie (Cookie Run),127,/tags/Angel%20Cookie%20(Cookie%20Run),c
Lemon Cookie (Cookie Run),69,/tags/Lemon%20Cookie%20(Cookie%20Run),c
Mustard Cookie (Cookie Run),71,/tags/Mustard%20Cookie%20(Cookie%20Run),c
Macaron Cookie (Cookie Run),27,/tags/Macaron%20Cookie%20(Cookie%20Run),c
Gumball Cookie (Cookie Run),122,/tags/Gumball%20Cookie%20(Cookie%20Run),c
Moon Rabbit Cookie (Cookie Run),43,/tags/Moon%20Rabbit%20Cookie%20(Cookie%20Run),c
Cherry Cookie (Cookie Run),96,/tags/Cherry%20Cookie%20(Cookie%20Run),c
Adventurer Cookie (Cookie Run),151,/tags/Adventurer%20Cookie%20(Cookie%20Run),c
Blackberry Cookie (Cookie Run),191,/tags/Blackberry%20Cookie%20(Cookie%20Run),c
Pink Choco Cookie (Cookie Run),34,/tags/Pink%20Choco%20Cookie%20(Cookie%20Run),c
Avocado Cookie (Cookie Run),66,/tags/Avocado%20Cookie%20(Cookie%20Run),c
Ice Candy Cookie (Cookie Run),8,/tags/Ice%20Candy%20Cookie%20(Cookie%20Run),c
Matcha Cookie (Cookie Run),38,/tags/Matcha%20Cookie%20(Cookie%20Run),c
Red Pepper Cookie (Cookie Run),20,/tags/Red%20Pepper%20Cookie%20(Cookie%20Run),c
Choco Drop (Cookie Run),2,/tags/Choco%20Drop%20(Cookie%20Run),c
Light Bros (Cookie Run),2,/tags/Light%20Bros%20(Cookie%20Run),c
Rosette (Cookie Run),1,/tags/Rosette%20(Cookie%20Run),c
Herb Teapot (Cookie Run),2,/tags/Herb%20Teapot%20(Cookie%20Run),c
Dark Spirit Helmet (Cookie Run),1,/tags/Dark%20Spirit%20Helmet%20(Cookie%20Run),c
Paprika Punching Bag (Cookie Run),1,/tags/Paprika%20Punching%20Bag%20(Cookie%20Run),c
Backpacky (Cookie Run),2,/tags/Backpacky%20(Cookie%20Run),c
Ninja Cookie (Cookie Run),42,/tags/Ninja%20Cookie%20(Cookie%20Run),c
Chili Pepper Cookie (Cookie Run),386,/tags/Chili%20Pepper%20Cookie%20(Cookie%20Run),c
Pirate Cookie (Cookie Run),68,/tags/Pirate%20Cookie%20(Cookie%20Run),c
Lucky Dice Bros (Cookie Run),1,/tags/Lucky%20Dice%20Bros%20(Cookie%20Run),c
Strawberry Cookie (Cookie Run),379,/tags/Strawberry%20Cookie%20(Cookie%20Run),c
Pocket Strawberry (Cookie Run),4,/tags/Pocket%20Strawberry%20(Cookie%20Run),c
GingerBrave | Brave Cookie,612,/tags/GingerBrave%20%7C%20Brave%20Cookie,c
Cheese Drop | Cheeseberry,0,/tags/Cheese%20Drop%20%7C%20Cheeseberry,c
Little Ghost | Ginger Ghost,0,/tags/Little%20Ghost%20%7C%20Ginger%20Ghost,c
Mr. Limeguard (Cookie Run),2,/tags/Mr*d*%20Limeguard%20(Cookie%20Run),c
Original Cookie Run Character(s),354,/tags/Original%20Cookie%20Run%20Character(s),c
GingerBrave | Brave Cookie/Hero Cookie,0,/tags/GingerBrave%20%7C%20Brave%20Cookie*s*Hero%20Cookie,r
Space Doughnut (Cookie Run),11,/tags/Space%20Doughnut%20(Cookie%20Run),c
Alchemist Cookie (Cookie Run),243,/tags/Alchemist%20Cookie%20(Cookie%20Run),c
Aloe Cookie (Cookie Run),98,/tags/Aloe%20Cookie%20(Cookie%20Run),c
Adventurer Cookie/Herb Cookie (Cookie Run),1,/tags/Adventurer%20Cookie*s*Herb%20Cookie%20(Cookie%20Run),r
Sparkling Cookie (Cookie Run),616,/tags/Sparkling%20Cookie%20(Cookie%20Run),c
Werewolf Cookie (Cookie Run),145,/tags/Werewolf%20Cookie%20(Cookie%20Run),c
Pomegranate Cookie (Cookie Run),661,/tags/Pomegranate%20Cookie%20(Cookie%20Run),c
Ion Cookie Robot (Cookie Run),22,/tags/Ion%20Cookie%20Robot%20(Cookie%20Run),c
Yoga Cookie (Cookie Run),4,/tags/Yoga%20Cookie%20(Cookie%20Run),c
Milk Cookie (Cookie Run),341,/tags/Milk%20Cookie%20(Cookie%20Run),c
Purple Yam Cookie (Cookie Run),284,/tags/Purple%20Yam%20Cookie%20(Cookie%20Run),c
Cocoa Cookie (Cookie Run),170,/tags/Cocoa%20Cookie%20(Cookie%20Run),c
Cheesecake Cookie (Cookie Run),70,/tags/Cheesecake%20Cookie%20(Cookie%20Run),c
Millennial Tree Cookie (Cookie Run),168,/tags/Millennial%20Tree%20Cookie%20(Cookie%20Run),c
Devil Cookie (Cookie Run),104,/tags/Devil%20Cookie%20(Cookie%20Run),c
AWOL Cracker (Cookie Run),0,/tags/AWOL%20Cracker%20(Cookie%20Run),c
Banana Cookie (Cookie Run),11,/tags/Banana%20Cookie%20(Cookie%20Run),c
Beet Cookie (Cookie Run),65,/tags/Beet%20Cookie%20(Cookie%20Run),c
Bow Tie Bottle (Cookie Run),0,/tags/Bow%20Tie%20Bottle%20(Cookie%20Run),c
Buttercream Choco Cookie (Cookie Run),3,/tags/Buttercream%20Choco%20Cookie%20(Cookie%20Run),c
GingerBright | Bright Cookie,86,/tags/GingerBright%20%7C%20Bright%20Cookie,c
Carol Cookie (Cookie Run),19,/tags/Carol%20Cookie%20(Cookie%20Run),c
Carrot Cookie (Cookie Run),60,/tags/Carrot%20Cookie%20(Cookie%20Run),c
Adventurer Cookie/Blackberry Cookie (Cookie Run),65,/tags/Adventurer%20Cookie*s*Blackberry%20Cookie%20(Cookie%20Run),r
Cream Puff Cookie (Cookie Run),247,/tags/Cream%20Puff%20Cookie%20(Cookie%20Run),c
Cyborg Cookie (Cookie Run),71,/tags/Cyborg%20Cookie%20(Cookie%20Run),c
Dino-Sour Cookie (Cookie Run),73,/tags/Dino-Sour%20Cookie%20(Cookie%20Run),c
DJ Cookie (Cookie Run),44,/tags/DJ%20Cookie%20(Cookie%20Run),c
Dr. Wasabi Cookie (Cookie Run),71,/tags/Dr*d*%20Wasabi%20Cookie%20(Cookie%20Run),c
Electro Lemon (Cookie Run),2,/tags/Electro%20Lemon%20(Cookie%20Run),c
Energy Scale (Cookie Run),0,/tags/Energy%20Scale%20(Cookie%20Run),c
Fig Cookie (Cookie Run),73,/tags/Fig%20Cookie%20(Cookie%20Run),c
Furball Pup (Cookie Run),1,/tags/Furball%20Pup%20(Cookie%20Run),c
General Jujube Cookie (Cookie Run),9,/tags/General%20Jujube%20Cookie%20(Cookie%20Run),c
Grapefruit Cookie (Cookie Run),21,/tags/Grapefruit%20Cookie%20(Cookie%20Run),c
Kiwi Cookie | Kiwi Biker Cookie,45,/tags/Kiwi%20Cookie%20%7C%20Kiwi%20Biker%20Cookie,c
Marshmallow Cookie (Cookie Run),19,/tags/Marshmallow%20Cookie%20(Cookie%20Run),c
Mini Orange Mouse (Cookie Run),0,/tags/Mini%20Orange%20Mouse%20(Cookie%20Run),c
Plum Cookie (Cookie Run),18,/tags/Plum%20Cookie%20(Cookie%20Run),c
Master Prune (Cookie Run),1,/tags/Master%20Prune%20(Cookie%20Run),c
Uncooling Teacup (Cookie Run),0,/tags/Uncooling%20Teacup%20(Cookie%20Run),c
Rockstar Cookie/Wind Archer Cookie (Cookie Run),0,/tags/Rockstar%20Cookie*s*Wind%20Archer%20Cookie%20(Cookie%20Run),r
Muscle Cookie (Cookie Run),49,/tags/Muscle%20Cookie%20(Cookie%20Run),c
Oak Barrel (Cookie Run),0,/tags/Oak%20Barrel%20(Cookie%20Run),c
Onion Cookie (Cookie Run),122,/tags/Onion%20Cookie%20(Cookie%20Run),c
Peach Cookie (Cookie Run),22,/tags/Peach%20Cookie%20(Cookie%20Run),c
Pilot Cookie (Cookie Run),7,/tags/Pilot%20Cookie%20(Cookie%20Run),c
Popcorn Cookie (Cookie Run),11,/tags/Popcorn%20Cookie%20(Cookie%20Run),c
Prophet Cookie (Cookie Run),12,/tags/Prophet%20Cookie%20(Cookie%20Run),c
Rebel Cookie (Cookie Run),16,/tags/Rebel%20Cookie%20(Cookie%20Run),c
Salt Cookie (Cookie Run),18,/tags/Salt%20Cookie%20(Cookie%20Run),c
Red Bean Cookie (Cookie Run),13,/tags/Red%20Bean%20Cookie%20(Cookie%20Run),c
Skater Cookie | Boarder Cookie,39,/tags/Skater%20Cookie%20%7C%20Boarder%20Cookie,c
Skating Queen Cookie (Cookie Run),6,/tags/Skating%20Queen%20Cookie%20(Cookie%20Run),c
Soda Cookie (Cookie Run),39,/tags/Soda%20Cookie%20(Cookie%20Run),c
Tiger Lily Cookie (Cookie Run),82,/tags/Tiger%20Lily%20Cookie%20(Cookie%20Run),c
Sugar Swan (Cookie Run),9,/tags/Sugar%20Swan%20(Cookie%20Run),c
Squid Ink Cookie (Cookie Run),105,/tags/Squid%20Ink%20Cookie%20(Cookie%20Run),c
Special Force Cookie (Cookie Run),1,/tags/Special%20Force%20Cookie%20(Cookie%20Run),c
Adventurer Cookie/Blackberry Cookie/Chili Pepper Cookie (Cookie Run),0,/tags/Adventurer%20Cookie*s*Blackberry%20Cookie*s*Chili%20Pepper%20Cookie%20(Cookie%20Run),r
Adventurer Cookie/Mint Choco Cookie (Cookie Run),0,/tags/Adventurer%20Cookie*s*Mint%20Choco%20Cookie%20(Cookie%20Run),r
Adventurer Cookie/Red Bean Cookie (Cookie Run),8,/tags/Adventurer%20Cookie*s*Red%20Bean%20Cookie%20(Cookie%20Run),r
Adventurer Cookie/Red Pepper Cookie (Cookie Run),0,/tags/Adventurer%20Cookie*s*Red%20Pepper%20Cookie%20(Cookie%20Run),r
Adventurer Cookie/Sparkling Cookie (Cookie Run),0,/tags/Adventurer%20Cookie*s*Sparkling%20Cookie%20(Cookie%20Run),r
Adventurer Cookie/Tiger Lily Cookie (Cookie Run),0,/tags/Adventurer%20Cookie*s*Tiger%20Lily%20Cookie%20(Cookie%20Run),r
Adventurer Cookie/Vampire Cookie (Cookie Run),0,/tags/Adventurer%20Cookie*s*Vampire%20Cookie%20(Cookie%20Run),r
Cinnamon Cookie/Kiwi Cookie | Kiwi Biker Cookie,0,/tags/Cinnamon%20Cookie*s*Kiwi%20Cookie%20%7C%20Kiwi%20Biker%20Cookie,r
Cinnamon Cookie/Dino-Sour Cookie (Cookie Run),0,/tags/Cinnamon%20Cookie*s*Dino-Sour%20Cookie%20(Cookie%20Run),r
Kiwi Cookie | Kiwi Biker Cookie/Rockstar Cookie,9,/tags/Kiwi%20Cookie%20%7C%20Kiwi%20Biker%20Cookie*s*Rockstar%20Cookie,r
Dino-Sour Cookie/Kiwi Cookie | Kiwi Biker Cookie,1,/tags/Dino-Sour%20Cookie*s*Kiwi%20Cookie%20%7C%20Kiwi%20Biker%20Cookie,r
Alchemist Cookie & Vampire Cookie (Cookie Run),61,/tags/Alchemist%20Cookie%20*a*%20Vampire%20Cookie%20(Cookie%20Run),r
Alchemist Cookie & Vampire Cookie & Werewolf Cookie (Cookie Run),2,/tags/Alchemist%20Cookie%20*a*%20Vampire%20Cookie%20*a*%20Werewolf%20Cookie%20(Cookie%20Run),r
Alchemist Cookie & Wizard Cookie (Cookie Run),4,/tags/Alchemist%20Cookie%20*a*%20Wizard%20Cookie%20(Cookie%20Run),r
Avocado Cookie/Blackberry Cookie (Cookie Run),1,/tags/Avocado%20Cookie*s*Blackberry%20Cookie%20(Cookie%20Run),r
Avocado Cookie/Chili Pepper Cookie (Cookie Run),1,/tags/Avocado%20Cookie*s*Chili%20Pepper%20Cookie%20(Cookie%20Run),r
Avocado Cookie/Dark Choco Cookie (Cookie Run),6,/tags/Avocado%20Cookie*s*Dark%20Choco%20Cookie%20(Cookie%20Run),r
Avocado Cookie (Cookie Run)/Everyone,1,/tags/Avocado%20Cookie%20(Cookie%20Run)*s*Everyone,r
Avocado Cookie/Ice Candy Cookie (Cookie Run),1,/tags/Avocado%20Cookie*s*Ice%20Candy%20Cookie%20(Cookie%20Run),r
Avocado Cookie/Matcha Cookie (Cookie Run),5,/tags/Avocado%20Cookie*s*Matcha%20Cookie%20(Cookie%20Run),r
Beet Cookie/Carrot Cookie (Cookie Run),26,/tags/Beet%20Cookie*s*Carrot%20Cookie%20(Cookie%20Run),r
Beet Cookie/Werewolf Cookie (Cookie Run),0,/tags/Beet%20Cookie*s*Werewolf%20Cookie%20(Cookie%20Run),r
Blackberry Cookie/Sparkling Cookie (Cookie Run),0,/tags/Blackberry%20Cookie*s*Sparkling%20Cookie%20(Cookie%20Run),r
Blackberry Cookie/White Choco Cookie (Cookie Run),0,/tags/Blackberry%20Cookie*s*White%20Choco%20Cookie%20(Cookie%20Run),r
GingerBright | Bright Cookie/Strawberry Cookie,17,/tags/GingerBright%20%7C%20Bright%20Cookie*s*Strawberry%20Cookie,r
Kiwi Cookie | Kiwi Biker Cookie/Roll Cake Cookie,16,/tags/Kiwi%20Cookie%20%7C%20Kiwi%20Biker%20Cookie*s*Roll%20Cake%20Cookie,r
Dark Choco Cookie/Knight Cookie (Cookie Run),2,/tags/Dark%20Choco%20Cookie*s*Knight%20Cookie%20(Cookie%20Run),r
Cinnamon Cookie & Marshmallow Cookie (Cookie Run),0,/tags/Cinnamon%20Cookie%20*a*%20Marshmallow%20Cookie%20(Cookie%20Run),r
Milk Cookie/Purple Yam Cookie (Cookie Run),138,/tags/Milk%20Cookie*s*Purple%20Yam%20Cookie%20(Cookie%20Run),r
Cinnamon Cookie/Roll Cake Cookie (Cookie Run),0,/tags/Cinnamon%20Cookie*s*Roll%20Cake%20Cookie%20(Cookie%20Run),r
Mint Choco Cookie/Rockstar Cookie (Cookie Run),18,/tags/Mint%20Choco%20Cookie*s*Rockstar%20Cookie%20(Cookie%20Run),r
Cheesecake Cookie/Cherry Blossom Cookie (Cookie Run),0,/tags/Cheesecake%20Cookie*s*Cherry%20Blossom%20Cookie%20(Cookie%20Run),r
Cheesecake Cookie/Princess Cookie (Cookie Run),2,/tags/Cheesecake%20Cookie*s*Princess%20Cookie%20(Cookie%20Run),r
Cheesecake Cookie/Sparkling Cookie (Cookie Run),4,/tags/Cheesecake%20Cookie*s*Sparkling%20Cookie%20(Cookie%20Run),r
Cherry Blossom Cookie/Hero Cookie (Cookie Run),1,/tags/Cherry%20Blossom%20Cookie*s*Hero%20Cookie%20(Cookie%20Run),r
Cherry Cookie/Gumball Cookie (Cookie Run),9,/tags/Cherry%20Cookie*s*Gumball%20Cookie%20(Cookie%20Run),r
Chili Pepper Cookie/Princess Cookie (Cookie Run),0,/tags/Chili%20Pepper%20Cookie*s*Princess%20Cookie%20(Cookie%20Run),r
Cinnamon Cookie/Lemon Cookie (Cookie Run),1,/tags/Cinnamon%20Cookie*s*Lemon%20Cookie%20(Cookie%20Run),r
Cinnamon Cookie/Mint Choco Cookie (Cookie Run),6,/tags/Cinnamon%20Cookie*s*Mint%20Choco%20Cookie%20(Cookie%20Run),r
Cocoa Cookie/Marshmallow Cookie (Cookie Run),0,/tags/Cocoa%20Cookie*s*Marshmallow%20Cookie%20(Cookie%20Run),r
Cocoa Cookie/Mint Choco Cookie (Cookie Run),108,/tags/Cocoa%20Cookie*s*Mint%20Choco%20Cookie%20(Cookie%20Run),r
Cocoa Cookie/Mint Choco Cookie/Rockstar Cookie (Cookie Run),2,/tags/Cocoa%20Cookie*s*Mint%20Choco%20Cookie*s*Rockstar%20Cookie%20(Cookie%20Run),r
Cocoa Cookie/Strawberry Cookie (Cookie Run),0,/tags/Cocoa%20Cookie*s*Strawberry%20Cookie%20(Cookie%20Run),r
Coffee Cookie/Tiger Lily Cookie (Cookie Run),0,/tags/Coffee%20Cookie*s*Tiger%20Lily%20Cookie%20(Cookie%20Run),r
Cotton Candy Cookie/Hero Cookie/Pink Choco Cookie (Cookie Run),0,/tags/Cotton%20Candy%20Cookie*s*Hero%20Cookie*s*Pink%20Choco%20Cookie%20(Cookie%20Run),r
Cotton Candy Cookie/Pink Choco Cookie (Cookie Run),6,/tags/Cotton%20Candy%20Cookie*s*Pink%20Choco%20Cookie%20(Cookie%20Run),r
Cotton Candy Cookie/Roll Cake Cookie (Cookie Run),2,/tags/Cotton%20Candy%20Cookie*s*Roll%20Cake%20Cookie%20(Cookie%20Run),r
Dark Choco Cookie & Whipped Cream Cookie (Cookie Run),0,/tags/Dark%20Choco%20Cookie%20*a*%20Whipped%20Cream%20Cookie%20(Cookie%20Run),r
Dark Choco Cookie (Cookie Run)/Original Character(s),1,/tags/Dark%20Choco%20Cookie%20(Cookie%20Run)*s*Original%20Character(s),r
Dark Choco Cookie/Werewolf Cookie (Cookie Run),19,/tags/Dark%20Choco%20Cookie*s*Werewolf%20Cookie%20(Cookie%20Run),r
Dark Enchantress Cookie/Millennial Tree Cookie (Cookie Run),3,/tags/Dark%20Enchantress%20Cookie*s*Millennial%20Tree%20Cookie%20(Cookie%20Run),r
Dino-Sour Cookie/Roll Cake Cookie (Cookie Run),0,/tags/Dino-Sour%20Cookie*s*Roll%20Cake%20Cookie%20(Cookie%20Run),r
DJ Cookie/Mint Choco Cookie (Cookie Run),0,/tags/DJ%20Cookie*s*Mint%20Choco%20Cookie%20(Cookie%20Run),r
DJ Cookie/Rockstar Cookie (Cookie Run),9,/tags/DJ%20Cookie*s*Rockstar%20Cookie%20(Cookie%20Run),r
DJ Cookie/Wind Archer Cookie (Cookie Run),0,/tags/DJ%20Cookie*s*Wind%20Archer%20Cookie%20(Cookie%20Run),r
Dino-Sour Cookie/Fire Spirit Cookie (Cookie Run),0,/tags/Dino-Sour%20Cookie*s*Fire%20Spirit%20Cookie%20(Cookie%20Run),r
Fire Spirit Cookie & Wind Archer Cookie (Cookie Run),12,/tags/Fire%20Spirit%20Cookie%20*a*%20Wind%20Archer%20Cookie%20(Cookie%20Run),r
Fire Spirit Cookie/Knight Cookie (Cookie Run),52,/tags/Fire%20Spirit%20Cookie*s*Knight%20Cookie%20(Cookie%20Run),r
Fire Spirit Cookie/Wind Archer Cookie (Cookie Run),86,/tags/Fire%20Spirit%20Cookie*s*Wind%20Archer%20Cookie%20(Cookie%20Run),r
Herb Cookie & Wind Archer Cookie (Cookie Run),6,/tags/Herb%20Cookie%20*a*%20Wind%20Archer%20Cookie%20(Cookie%20Run),r
Fire Spirit Cookie & Knight Cookie (Cookie Run),7,/tags/Fire%20Spirit%20Cookie%20*a*%20Knight%20Cookie%20(Cookie%20Run),r
Herb Cookie/Hero Cookie (Cookie Run),1,/tags/Herb%20Cookie*s*Hero%20Cookie%20(Cookie%20Run),r
Herb Cookie/Mint Choco Cookie/Rockstar Cookie (Cookie Run),0,/tags/Herb%20Cookie*s*Mint%20Choco%20Cookie*s*Rockstar%20Cookie%20(Cookie%20Run),r
Herb Cookie/Pistachio Cookie (Cookie Run),0,/tags/Herb%20Cookie*s*Pistachio%20Cookie%20(Cookie%20Run),r
Herb Cookie/Rockstar Cookie (Cookie Run),5,/tags/Herb%20Cookie*s*Rockstar%20Cookie%20(Cookie%20Run),r
Herb Cookie/Sparkling Cookie (Cookie Run),143,/tags/Herb%20Cookie*s*Sparkling%20Cookie%20(Cookie%20Run),r
Herb Cookie/Werewolf Cookie (Cookie Run),7,/tags/Herb%20Cookie*s*Werewolf%20Cookie%20(Cookie%20Run),r
Herb Cookie/Wind Archer Cookie (Cookie Run),29,/tags/Herb%20Cookie*s*Wind%20Archer%20Cookie%20(Cookie%20Run),r
Herb Cookie/Whipped Cream Cookie (Cookie Run),1,/tags/Herb%20Cookie*s*Whipped%20Cream%20Cookie%20(Cookie%20Run),r
Hero Cookie/Lemon Cookie (Cookie Run),8,/tags/Hero%20Cookie*s*Lemon%20Cookie%20(Cookie%20Run),r
Hero Cookie/Rockstar Cookie (Cookie Run),0,/tags/Hero%20Cookie*s*Rockstar%20Cookie%20(Cookie%20Run),r
Kiwi Cookie | Kiwi Biker Cookie/Lemon Cookie,2,/tags/Kiwi%20Cookie%20%7C%20Kiwi%20Biker%20Cookie*s*Lemon%20Cookie,r
Kiwi Cookie | Kiwi Biker Cookie/Werewolf Cookie,0,/tags/Kiwi%20Cookie%20%7C%20Kiwi%20Biker%20Cookie*s*Werewolf%20Cookie,r
Kiwi Cookie | Kiwi Biker Cookie/Wind Archer Cookie,1,/tags/Kiwi%20Cookie%20%7C%20Kiwi%20Biker%20Cookie*s*Wind%20Archer%20Cookie,r
Knight Cookie & Pomegranate Cookie (Cookie Run),0,/tags/Knight%20Cookie%20*a*%20Pomegranate%20Cookie%20(Cookie%20Run),r
Knight Cookie & Wind Archer Cookie (Cookie Run),0,/tags/Knight%20Cookie%20*a*%20Wind%20Archer%20Cookie%20(Cookie%20Run),r
Herb Cookie/Knight Cookie (Cookie Run),0,/tags/Herb%20Cookie*s*Knight%20Cookie%20(Cookie%20Run),r
Knight Cookie/Princess Cookie (Cookie Run),76,/tags/Knight%20Cookie*s*Princess%20Cookie%20(Cookie%20Run),r
Knight Cookie/Rockstar Cookie (Cookie Run),0,/tags/Knight%20Cookie*s*Rockstar%20Cookie%20(Cookie%20Run),r
Knight Cookie/Wind Archer Cookie (Cookie Run),3,/tags/Knight%20Cookie*s*Wind%20Archer%20Cookie%20(Cookie%20Run),r
Kumiho Cookie | Ninetales Cookie/Lemon Cookie,0,/tags/Kumiho%20Cookie%20%7C%20Ninetales%20Cookie*s*Lemon%20Cookie,r
Kumiho Cookie | Ninetales Cookie/Werewolf Cookie,6,/tags/Kumiho%20Cookie%20%7C%20Ninetales%20Cookie*s*Werewolf%20Cookie,r
Lemon Cookie/Orange Cookie (Cookie Run),4,/tags/Lemon%20Cookie*s*Orange%20Cookie%20(Cookie%20Run),r
Lemon Cookie/Whipped Cream Cookie (Cookie Run),0,/tags/Lemon%20Cookie*s*Whipped%20Cream%20Cookie%20(Cookie%20Run),r
Lime Cookie/Orange Cookie (Cookie Run),15,/tags/Lime%20Cookie*s*Orange%20Cookie%20(Cookie%20Run),r
Macaron Cookie/Marshmallow Cookie (Cookie Run),11,/tags/Macaron%20Cookie*s*Marshmallow%20Cookie%20(Cookie%20Run),r
Macaron Cookie/Mustard Cookie (Cookie Run),0,/tags/Macaron%20Cookie*s*Mustard%20Cookie%20(Cookie%20Run),r
Millennial Tree Cookie & Wind Archer Cookie (Cookie Run),14,/tags/Millennial%20Tree%20Cookie%20*a*%20Wind%20Archer%20Cookie%20(Cookie%20Run),r
Millennial Tree Cookie/Pomegranate Cookie (Cookie Run),0,/tags/Millennial%20Tree%20Cookie*s*Pomegranate%20Cookie%20(Cookie%20Run),r
Mint Choco Cookie/Sparkling Cookie (Cookie Run),20,/tags/Mint%20Choco%20Cookie*s*Sparkling%20Cookie%20(Cookie%20Run),r
Mint Choco Cookie/Wind Archer Cookie (Cookie Run),0,/tags/Mint%20Choco%20Cookie*s*Wind%20Archer%20Cookie%20(Cookie%20Run),r
Moonlight Cookie & Peppermint Cookie (Cookie Run),2,/tags/Moonlight%20Cookie%20*a*%20Peppermint%20Cookie%20(Cookie%20Run),r
Moonlight Cookie/Sea Fairy Cookie (Cookie Run),216,/tags/Moonlight%20Cookie*s*Sea%20Fairy%20Cookie%20(Cookie%20Run),r
Mustard Cookie/Strawberry Cookie (Cookie Run),2,/tags/Mustard%20Cookie*s*Strawberry%20Cookie%20(Cookie%20Run),r
Pancake Cookie/Peppermint Cookie (Cookie Run),0,/tags/Pancake%20Cookie*s*Peppermint%20Cookie%20(Cookie%20Run),r
Peach Cookie/White Choco Cookie (Cookie Run),0,/tags/Peach%20Cookie*s*White%20Choco%20Cookie%20(Cookie%20Run),r
Peppermint Cookie & Sea Fairy Cookie (Cookie Run),8,/tags/Peppermint%20Cookie%20*a*%20Sea%20Fairy%20Cookie%20(Cookie%20Run),r
Pirate Cookie/Salt Cookie (Cookie Run),8,/tags/Pirate%20Cookie*s*Salt%20Cookie%20(Cookie%20Run),r
Pistachio Cookie/Princess Cookie (Cookie Run),1,/tags/Pistachio%20Cookie*s*Princess%20Cookie%20(Cookie%20Run),r
Pistachio Cookie/White Choco Cookie (Cookie Run),8,/tags/Pistachio%20Cookie*s*White%20Choco%20Cookie%20(Cookie%20Run),r
Pomegranate Cookie & Wind Archer Cookie (Cookie Run),0,/tags/Pomegranate%20Cookie%20*a*%20Wind%20Archer%20Cookie%20(Cookie%20Run),r
Pomegranate Cookie/Wind Archer Cookie (Cookie Run),0,/tags/Pomegranate%20Cookie*s*Wind%20Archer%20Cookie%20(Cookie%20Run),r
Rockstar Cookie/Vampire Cookie (Cookie Run),4,/tags/Rockstar%20Cookie*s*Vampire%20Cookie%20(Cookie%20Run),r
Skating Queen Cookie/Snow Sugar Cookie (Cookie Run),0,/tags/Skating%20Queen%20Cookie*s*Snow%20Sugar%20Cookie%20(Cookie%20Run),r
Snow Sugar Cookie/Wizard Cookie (Cookie Run),4,/tags/Snow%20Sugar%20Cookie*s*Wizard%20Cookie%20(Cookie%20Run),r
Sparkling Cookie/Vampire Cookie (Cookie Run),145,/tags/Sparkling%20Cookie*s*Vampire%20Cookie%20(Cookie%20Run),r
Special Force Cookie/Tiger Lily Cookie (Cookie Run),0,/tags/Special%20Force%20Cookie*s*Tiger%20Lily%20Cookie%20(Cookie%20Run),r
Vampire Cookie & Wizard Cookie (Cookie Run),0,/tags/Vampire%20Cookie%20*a*%20Wizard%20Cookie%20(Cookie%20Run),r
Werewolf Cookie & Wizard Cookie (Cookie Run),1,/tags/Werewolf%20Cookie%20*a*%20Wizard%20Cookie%20(Cookie%20Run),r
Tiger Lily Cookie/Werewolf Cookie (Cookie Run),7,/tags/Tiger%20Lily%20Cookie*s*Werewolf%20Cookie%20(Cookie%20Run),r
Soda Cookie (Cookie Run)/Original Character(s),0,/tags/Soda%20Cookie%20(Cookie%20Run)*s*Original%20Character(s),r
Fire Spirit Cookie & Sea Fairy Cookie (Cookie Run),5,/tags/Fire%20Spirit%20Cookie%20*a*%20Sea%20Fairy%20Cookie%20(Cookie%20Run),r
Vampire Cookie/Whipped Cream Cookie (Cookie Run),1,/tags/Vampire%20Cookie*s*Whipped%20Cream%20Cookie%20(Cookie%20Run),r
Aloe Cookie/Cyborg Cookie (Cookie Run),40,/tags/Aloe%20Cookie*s*Cyborg%20Cookie%20(Cookie%20Run),r
Rockstar Cookie/Yogurt Cream Cookie (Cookie Run),0,/tags/Rockstar%20Cookie*s*Yogurt%20Cream%20Cookie%20(Cookie%20Run),r
Yogurt Cream Cookie (Cookie Run),264,/tags/Yogurt%20Cream%20Cookie%20(Cookie%20Run),c
Lilac Cookie (Cookie Run),377,/tags/Lilac%20Cookie%20(Cookie%20Run),c
Cyborg Cookie/Hero Cookie (Cookie Run),0,/tags/Cyborg%20Cookie*s*Hero%20Cookie%20(Cookie%20Run),r
Fire Spirit Cookie/Moonlight Cookie (Cookie Run),1,/tags/Fire%20Spirit%20Cookie*s*Moonlight%20Cookie%20(Cookie%20Run),r
Aloe Cookie/Hero Cookie (Cookie Run),2,/tags/Aloe%20Cookie*s*Hero%20Cookie%20(Cookie%20Run),r
Shopkeeper Cookie (Cookie Run),0,/tags/Shopkeeper%20Cookie%20(Cookie%20Run),c
Fire Spirit Cookie/Herb Cookie (Cookie Run),7,/tags/Fire%20Spirit%20Cookie*s*Herb%20Cookie%20(Cookie%20Run),r
Cotton Candy Cookie/Dino-Sour Cookie (Cookie Run),2,/tags/Cotton%20Candy%20Cookie*s*Dino-Sour%20Cookie%20(Cookie%20Run),r
Milk Cookie & Purple Yam Cookie (Cookie Run),28,/tags/Milk%20Cookie%20*a*%20Purple%20Yam%20Cookie%20(Cookie%20Run),r
Vampire Cookie & Werewolf Cookie (Cookie Run),0,/tags/Vampire%20Cookie%20*a*%20Werewolf%20Cookie%20(Cookie%20Run),r
Vampire Cookie/Werewolf Cookie (Cookie Run),32,/tags/Vampire%20Cookie*s*Werewolf%20Cookie%20(Cookie%20Run),r
Matcha Cookie/Milk Cookie (Cookie Run),0,/tags/Matcha%20Cookie*s*Milk%20Cookie%20(Cookie%20Run),r
Fire Spirit Cookie/Millennial Tree Cookie (Cookie Run),2,/tags/Fire%20Spirit%20Cookie*s*Millennial%20Tree%20Cookie%20(Cookie%20Run),r
Cinnamon Cookie/Rockstar Cookie (Cookie Run),1,/tags/Cinnamon%20Cookie*s*Rockstar%20Cookie%20(Cookie%20Run),r
Dark Choco Cookie/Mint Choco Cookie (Cookie Run),7,/tags/Dark%20Choco%20Cookie*s*Mint%20Choco%20Cookie%20(Cookie%20Run),r
Millennial Tree Cookie/Wind Archer Cookie (Cookie Run),12,/tags/Millennial%20Tree%20Cookie*s*Wind%20Archer%20Cookie%20(Cookie%20Run),r
Night Raven (Cookie Run),15,/tags/Night%20Raven%20(Cookie%20Run),c
Walnut Cookie (Cookie Run),297,/tags/Walnut%20Cookie%20(Cookie%20Run),c
Dark Choco Cookie/Pink Choco Cookie (Cookie Run),0,/tags/Dark%20Choco%20Cookie*s*Pink%20Choco%20Cookie%20(Cookie%20Run),r
Dark Choco Cookie/Princess Cookie (Cookie Run),1,/tags/Dark%20Choco%20Cookie*s*Princess%20Cookie%20(Cookie%20Run),r
Cocoa Cookie/Kiwi Cookie | Kiwi Biker Cookie,0,/tags/Cocoa%20Cookie*s*Kiwi%20Cookie%20%7C%20Kiwi%20Biker%20Cookie,r
Dark Choco Cookie/Purple Yam Cookie (Cookie Run),25,/tags/Dark%20Choco%20Cookie*s*Purple%20Yam%20Cookie%20(Cookie%20Run),r
Lilac Cookie/Yogurt Cream Cookie (Cookie Run),191,/tags/Lilac%20Cookie*s*Yogurt%20Cream%20Cookie%20(Cookie%20Run),r
Yogurt Cream Cookie (Cookie Run)/Original Character(s),0,/tags/Yogurt%20Cream%20Cookie%20(Cookie%20Run)*s*Original%20Character(s),r
Dark Enchantress Cookie/Sea Fairy Cookie (Cookie Run),1,/tags/Dark%20Enchantress%20Cookie*s*Sea%20Fairy%20Cookie%20(Cookie%20Run),r
Lilac Cookie & Yogurt Cream Cookie (Cookie Run),49,/tags/Lilac%20Cookie%20*a*%20Yogurt%20Cream%20Cookie%20(Cookie%20Run),r
Roguefort Cookie (Cookie Run),450,/tags/Roguefort%20Cookie%20(Cookie%20Run),c
