tag,count,href,category
Caramel Arrow Cookie/Red Velvet Cookie (Cookie Run),0,/tags/Caramel%20Arrow%20Cookie*s*Red%20Velvet%20Cookie%20(Cookie%20Run),r
Cocoa Cookie (Cookie Run) & Original Character(s),1,/tags/Cocoa%20Cookie%20(Cookie%20Run)%20*a*%20Original%20Character(s),r
Espresso Cookie (Cookie Run)/Ruv (Friday Night Funkin'),0,/tags/Espresso%20Cookie%20(Cookie%20Run)*s*Ruv%20(Friday%20Night%20Funkin'),r
Caramel Arrow Cookie/Financier Cookie (Cookie Run),5,/tags/Caramel%20Arrow%20Cookie*s*Financier%20Cookie%20(Cookie%20Run),r
Knight Cookie (Cookie Run)/Original Character(s),0,/tags/Knight%20Cookie%20(Cookie%20Run)*s*Original%20Character(s),r
Financier Cookie & Madeleine Cookie (Cookie Run),4,/tags/Financier%20Cookie%20*a*%20Madeleine%20Cookie%20(Cookie%20Run),r
Strawberry Cookie & Wild Strawberry Cookie | Original Wildberry Cookie,0,/tags/Strawberry%20Cookie%20*a*%20Wild%20Strawberry%20Cookie%20%7C%20Original%20Wildberry%20Cookie,r
Cranberry Cookie/Lychee Dragon Cookie (Cookie Run),1,/tags/Cranberry%20Cookie*s*Lychee%20Dragon%20Cookie%20(Cookie%20Run),r
Cranberry Cookie & Princess Cookie (Cookie Run),1,/tags/Cranberry%20Cookie%20*a*%20Princess%20Cookie%20(Cookie%20Run),r
Cranberry Cookie & Knight Cookie (Cookie Run),1,/tags/Cranberry%20Cookie%20*a*%20Knight%20Cookie%20(Cookie%20Run),r
Pizza Cookie/Timekeeper Cookie (Cookie Run),1,/tags/Pizza%20Cookie*s*Timekeeper%20Cookie%20(Cookie%20Run),r
Captain Caviar Cookie (Cookie Run)/Original Character(s),3,/tags/Captain%20Caviar%20Cookie%20(Cookie%20Run)*s*Original%20Character(s),r
Alchemist Cookie & Yogurt Cream Cookie (Cookie Run),1,/tags/Alchemist%20Cookie%20*a*%20Yogurt%20Cream%20Cookie%20(Cookie%20Run),r
Alchemist Cookie & Lilac Cookie (Cookie Run),1,/tags/Alchemist%20Cookie%20*a*%20Lilac%20Cookie%20(Cookie%20Run),r
Captain Caviar Cookie & Oyster Cookie (Cookie Run),18,/tags/Captain%20Caviar%20Cookie%20*a*%20Oyster%20Cookie%20(Cookie%20Run),r
Black Pearl Cookie/Oyster Cookie (Cookie Run),3,/tags/Black%20Pearl%20Cookie*s*Oyster%20Cookie%20(Cookie%20Run),r
Caramel Arrow Cookie/Financier Cookie/Pastry Cookie (Cookie Run),1,/tags/Caramel%20Arrow%20Cookie*s*Financier%20Cookie*s*Pastry%20Cookie%20(Cookie%20Run),r
Mustard Cookie & Strawberry Cookie & Wizard Cookie (Cookie Run),0,/tags/Mustard%20Cookie%20*a*%20Strawberry%20Cookie%20*a*%20Wizard%20Cookie%20(Cookie%20Run),r
Oyster Cookie (Cookie Run) & Original Character(s),2,/tags/Oyster%20Cookie%20(Cookie%20Run)%20*a*%20Original%20Character(s),r
Cookies of Darkness Members & Red Velvet Cookie (Cookie Run),0,/tags/Cookies%20of%20Darkness%20Members%20*a*%20Red%20Velvet%20Cookie%20(Cookie%20Run),r
Hero Cookie/Vampire Cookie (Cookie Run),0,/tags/Hero%20Cookie*s*Vampire%20Cookie%20(Cookie%20Run),r
Candy Diver Cookie (Cookie Run),24,/tags/Candy%20Diver%20Cookie%20(Cookie%20Run),c
Minami Koutarou & Peperoncino Cookie (Cookie Run),0,/tags/Minami%20Koutarou%20*a*%20Peperoncino%20Cookie%20(Cookie%20Run),r
Ananas Dragon Cookie & Golden Cheese Cookie (Cookie Run),1,/tags/Ananas%20Dragon%20Cookie%20*a*%20Golden%20Cheese%20Cookie%20(Cookie%20Run),r
Black Pearl Cookie & Captain Caviar Cookie (Cookie Run),7,/tags/Black%20Pearl%20Cookie%20*a*%20Captain%20Caviar%20Cookie%20(Cookie%20Run),r
Captain Ice Cookie/Shining Glitter Cookie (Cookie Run),1,/tags/Captain%20Ice%20Cookie*s*Shining%20Glitter%20Cookie%20(Cookie%20Run),r
Captain Ice Cookie & Shining Glitter Cookie (Cookie Run),1,/tags/Captain%20Ice%20Cookie%20*a*%20Shining%20Glitter%20Cookie%20(Cookie%20Run),r
Cookie Run Characters Are Cookies,47,/tags/Cookie%20Run%20Characters%20Are%20Cookies,f
Cream Unicorn Cookie/Herb Cookie/Sparkling Cookie/Vampire Cookie (Cookie Run),1,/tags/Cream%20Unicorn%20Cookie*s*Herb%20Cookie*s*Sparkling%20Cookie*s*Vampire%20Cookie%20(Cookie%20Run),r
Pastry Cookie & Strawberry Cookie (Cookie Run),0,/tags/Pastry%20Cookie%20*a*%20Strawberry%20Cookie%20(Cookie%20Run),r
Cotton Candy Cookie (Cookie Run)/Original Character(s),1,/tags/Cotton%20Candy%20Cookie%20(Cookie%20Run)*s*Original%20Character(s),r
Cookie Run Ensemble/Cookie Run Ensemble,1,/tags/Cookie%20Run%20Ensemble*s*Cookie%20Run%20Ensemble,r
Golden Cheese Cookie & Hollyberry Cookie (Cookie Run),1,/tags/Golden%20Cheese%20Cookie%20*a*%20Hollyberry%20Cookie%20(Cookie%20Run),r
Chocolate Bonbon Cookie (Cookie Run) & Original Character(s),0,/tags/Chocolate%20Bonbon%20Cookie%20(Cookie%20Run)%20*a*%20Original%20Character(s),r
Black Pearl Cookie & Captain Ice Cookie (Cookie Run),0,/tags/Black%20Pearl%20Cookie%20*a*%20Captain%20Ice%20Cookie%20(Cookie%20Run),r
Black Pearl Cookie & Oyster Cookie (Cookie Run),3,/tags/Black%20Pearl%20Cookie%20*a*%20Oyster%20Cookie%20(Cookie%20Run),r
Black Pearl Cookie (Cookie Run)/You,2,/tags/Black%20Pearl%20Cookie%20(Cookie%20Run)*s*You,r
Captain Caviar Cookie (Cookie Run)/You,3,/tags/Captain%20Caviar%20Cookie%20(Cookie%20Run)*s*You,r
Captain Caviar Cookie (Cookie Run) & Original Character(s),1,/tags/Captain%20Caviar%20Cookie%20(Cookie%20Run)%20*a*%20Original%20Character(s),r
Candy Diver Cookie/Captain Caviar Cookie (Cookie Run),6,/tags/Candy%20Diver%20Cookie*s*Captain%20Caviar%20Cookie%20(Cookie%20Run),r
Black Pearl Cookie/Captain Ice Cookie (Cookie Run),1,/tags/Black%20Pearl%20Cookie*s*Captain%20Ice%20Cookie%20(Cookie%20Run),r
Licorice Cookie & Lotus Dragon Cookie (Cookie Run),0,/tags/Licorice%20Cookie%20*a*%20Lotus%20Dragon%20Cookie%20(Cookie%20Run),r
Licorice Cookie & Timekeeper Cookie (Cookie Run),0,/tags/Licorice%20Cookie%20*a*%20Timekeeper%20Cookie%20(Cookie%20Run),r
Licorice Cookie & Wizard Cookie (Cookie Run),0,/tags/Licorice%20Cookie%20*a*%20Wizard%20Cookie%20(Cookie%20Run),r
Lotus Dragon Cookie & Timekeeper Cookie (Cookie Run),0,/tags/Lotus%20Dragon%20Cookie%20*a*%20Timekeeper%20Cookie%20(Cookie%20Run),r
Lotus Dragon Cookie & Wizard Cookie (Cookie Run),0,/tags/Lotus%20Dragon%20Cookie%20*a*%20Wizard%20Cookie%20(Cookie%20Run),r
Financier Cookie/Madeleine Cookie (Cookie Run),3,/tags/Financier%20Cookie*s*Madeleine%20Cookie%20(Cookie%20Run),r
Oyster Cookie (Cookie Run) & You,0,/tags/Oyster%20Cookie%20(Cookie%20Run)%20*a*%20You,r
Timekeeper Cookie & Wizard Cookie (Cookie Run),0,/tags/Timekeeper%20Cookie%20*a*%20Wizard%20Cookie%20(Cookie%20Run),r
Butter Pretzel Cookie/Mint Choco Cookie (Cookie Run),0,/tags/Butter%20Pretzel%20Cookie*s*Mint%20Choco%20Cookie%20(Cookie%20Run),r
Dr. Bones Cookie/Truffle Cookie (Cookie Run),0,/tags/Dr*d*%20Bones%20Cookie*s*Truffle%20Cookie%20(Cookie%20Run),r
Espresso Cookie/Vampire Cookie (Cookie Run)/You,0,/tags/Espresso%20Cookie*s*Vampire%20Cookie%20(Cookie%20Run)*s*You,r
Original Cookie Run Character(s) & Original Cookie Run Character(s),1,/tags/Original%20Cookie%20Run%20Character(s)%20*a*%20Original%20Cookie%20Run%20Character(s),r
Mentioned Alchemist Cookie (Cookie Run),2,/tags/Mentioned%20Alchemist%20Cookie%20(Cookie%20Run),f
Past Almond Cookie/Latte Cookie (Cookie Run),1,/tags/Past%20Almond%20Cookie*s*Latte%20Cookie%20(Cookie%20Run),f
Longan Dragon Cookie & Pitaya Dragon Cookie (Cookie Run),1,/tags/Longan%20Dragon%20Cookie%20*a*%20Pitaya%20Dragon%20Cookie%20(Cookie%20Run),r
Cream Unicorn Cookie/Sparkling Cookie (Cookie Run),3,/tags/Cream%20Unicorn%20Cookie*s*Sparkling%20Cookie%20(Cookie%20Run),r
Cookie Run Characters Are Ambiguously Cookies or Human,45,/tags/Cookie%20Run%20Characters%20Are%20Ambiguously%20Cookies%20or%20Human,f
Parent Fire Spirit Cookie (Cookie Run),1,/tags/Parent%20Fire%20Spirit%20Cookie%20(Cookie%20Run),f
Madeleine Cookie Being an Idiot (Cookie Run),8,/tags/Madeleine%20Cookie%20Being%20an%20Idiot%20(Cookie%20Run),f
Dead Knight Cookie (Cookie Run),0,/tags/Dead%20Knight%20Cookie%20(Cookie%20Run),f
Dead Avocado Cookie (Cookie Run),0,/tags/Dead%20Avocado%20Cookie%20(Cookie%20Run),f
Espresso Cookie Nearly Dies (Cookie Run),0,/tags/Espresso%20Cookie%20Nearly%20Dies%20(Cookie%20Run),f
Clotted Cream Cookie & Lychee Dragon Cookie (Cookie Run),1,/tags/Clotted%20Cream%20Cookie%20*a*%20Lychee%20Dragon%20Cookie%20(Cookie%20Run),r
Birthday Cake Cookie/Licorice Cookie (Cookie Run),1,/tags/Birthday%20Cake%20Cookie*s*Licorice%20Cookie%20(Cookie%20Run),r
Vagabond Cookie (Cookie Run),19,/tags/Vagabond%20Cookie%20(Cookie%20Run),c
Rebel Cookie/Vagabond Cookie (Cookie Run),11,/tags/Rebel%20Cookie*s*Vagabond%20Cookie%20(Cookie%20Run),r
Ba-Dum Ray (Cookie Run),0,/tags/Ba-Dum%20Ray%20(Cookie%20Run),c
Clotted Cream Cookie/Dark Cacao Cookie (Cookie Run),0,/tags/Clotted%20Cream%20Cookie*s*Dark%20Cacao%20Cookie%20(Cookie%20Run),r
Pomegranate Cookie (Cookie Run)/Everyone,0,/tags/Pomegranate%20Cookie%20(Cookie%20Run)*s*Everyone,r
Fig Cookie/Mango Cookie (Cookie Run),1,/tags/Fig%20Cookie*s*Mango%20Cookie%20(Cookie%20Run),r
Rambutan Cookie (Cookie Run)/Original Character(s),0,/tags/Rambutan%20Cookie%20(Cookie%20Run)*s*Original%20Character(s),r
Ananas Dragon Cookie (Cookie Run) & Original Character(s),0,/tags/Ananas%20Dragon%20Cookie%20(Cookie%20Run)%20*a*%20Original%20Character(s),r
Tiramisu Cookie & Wizard Cookie (Cookie Run),0,/tags/Tiramisu%20Cookie%20*a*%20Wizard%20Cookie%20(Cookie%20Run),r
Candlelight Cookie & Moon Rabbit Cookie (Cookie Run),0,/tags/Candlelight%20Cookie%20*a*%20Moon%20Rabbit%20Cookie%20(Cookie%20Run),r
Captain Caviar Cookie (Cookie Run)/Original Female Character(s),3,/tags/Captain%20Caviar%20Cookie%20(Cookie%20Run)*s*Original%20Female%20Character(s),r
Chocolate Bonbon Cookie/Eggnog Cookie (Cookie Run),0,/tags/Chocolate%20Bonbon%20Cookie*s*Eggnog%20Cookie%20(Cookie%20Run),r
Clotted Cream Cookie & Oyster Cookie (Cookie Run),1,/tags/Clotted%20Cream%20Cookie%20*a*%20Oyster%20Cookie%20(Cookie%20Run),r
Crowberry Cookie/Kumiho Cookie | Ninetales Cookie,0,/tags/Crowberry%20Cookie*s*Kumiho%20Cookie%20%7C%20Ninetales%20Cookie,r
Custard Cookie III & Dark Cacao Cookie (Cookie Run),0,/tags/Custard%20Cookie%20III%20*a*%20Dark%20Cacao%20Cookie%20(Cookie%20Run),r
Dark Choco Cookie/Madeleine Cookie/Milk Cookie (Cookie Run),0,/tags/Dark%20Choco%20Cookie*s*Madeleine%20Cookie*s*Milk%20Cookie%20(Cookie%20Run),r
Ice Juggler Cookie & Moon Rabbit Cookie (Cookie Run),0,/tags/Ice%20Juggler%20Cookie%20*a*%20Moon%20Rabbit%20Cookie%20(Cookie%20Run),r
Cream Unicorn Cookie/Licorice Cookie (Cookie Run),0,/tags/Cream%20Unicorn%20Cookie*s*Licorice%20Cookie%20(Cookie%20Run),r
Affogato Cookie/Muscle Cookie (Cookie Run),0,/tags/Affogato%20Cookie*s*Muscle%20Cookie%20(Cookie%20Run),r
Mala Sauce Cookie/Pitaya Dragon Cookie (Cookie Run),1,/tags/Mala%20Sauce%20Cookie*s*Pitaya%20Dragon%20Cookie%20(Cookie%20Run),r
Rose Cookie/Whipped Cream Cookie (Cookie Run),0,/tags/Rose%20Cookie*s*Whipped%20Cream%20Cookie%20(Cookie%20Run),r
Fig Cookie & Wind Archer Cookie (Cookie Run),0,/tags/Fig%20Cookie%20*a*%20Wind%20Archer%20Cookie%20(Cookie%20Run),r
Clotted Cream Cookie (Cookie Run) & Original Female Character(s),0,/tags/Clotted%20Cream%20Cookie%20(Cookie%20Run)%20*a*%20Original%20Female%20Character(s),r
Minor Dark Cacao Cookie/Pure Vanilla Cookie (Cookie Run),4,/tags/Minor%20Dark%20Cacao%20Cookie*s*Pure%20Vanilla%20Cookie%20(Cookie%20Run),f
Bottom Pure Vanilla Cookie (Cookie Run),3,/tags/Bottom%20Pure%20Vanilla%20Cookie%20(Cookie%20Run),f
Post-Episode: e14 Citadel of the Frozen Cliff,0,/tags/Post-Episode:%20e14%20Citadel%20of%20the%20Frozen%20Cliff,f
Eggnog Cookie/Captain Ice Cookie (Cookie Run),2,/tags/Eggnog%20Cookie*s*Captain%20Ice%20Cookie%20(Cookie%20Run),r
Captain Caviar Cookie (Cookie Run)/Original Male Character(s),0,/tags/Captain%20Caviar%20Cookie%20(Cookie%20Run)*s*Original%20Male%20Character(s),r
Mint Choco Cookie & Vampire Cookie (Cookie Run),4,/tags/Mint%20Choco%20Cookie%20*a*%20Vampire%20Cookie%20(Cookie%20Run),r
Herb Cookie (Cookie Run) & Original Character(s),1,/tags/Herb%20Cookie%20(Cookie%20Run)%20*a*%20Original%20Character(s),r
Wild Strawberry Cookie | Original WIldberry Cookie/Original Character(s),0,/tags/Wild%20Strawberry%20Cookie%20%7C%20Original%20WIldberry%20Cookie*s*Original%20Character(s),r
Dark Choco Cookie & Kumiho Cookie | Ninetales Cookie,1,/tags/Dark%20Choco%20Cookie%20*a*%20Kumiho%20Cookie%20%7C%20Ninetales%20Cookie,r
Kumiho Cookie | Ninetales Cookie & Pomegranate Cookie,0,/tags/Kumiho%20Cookie%20%7C%20Ninetales%20Cookie%20*a*%20Pomegranate%20Cookie,r
Kumiho Cookie | Ninetales Cookie/Pomegranate Cookie,0,/tags/Kumiho%20Cookie%20%7C%20Ninetales%20Cookie*s*Pomegranate%20Cookie,r
Toothpaste Cookie (Cookie Run)/Original Character(s),1,/tags/Toothpaste%20Cookie%20(Cookie%20Run)*s*Original%20Character(s),r
Toothpaste Cookie/Vampire Cookie (Cookie Run),1,/tags/Toothpaste%20Cookie*s*Vampire%20Cookie%20(Cookie%20Run),r
Dark Choco Cookie & Pastry Cookie (Cookie Run),1,/tags/Dark%20Choco%20Cookie%20*a*%20Pastry%20Cookie%20(Cookie%20Run),r
Clover Cookie/Red Velvet Cookie (Cookie Run)/Original Character(s),0,/tags/Clover%20Cookie*s*Red%20Velvet%20Cookie%20(Cookie%20Run)*s*Original%20Character(s),r
Financier Cookie & Raspberry Cookie (Cookie Run),0,/tags/Financier%20Cookie%20*a*%20Raspberry%20Cookie%20(Cookie%20Run),r
Lilybell Cookie (Cookie Run),11,/tags/Lilybell%20Cookie%20(Cookie%20Run),c
Lobster Cookie & Timekeeper Cookie (Cookier Run),1,/tags/Lobster%20Cookie%20*a*%20Timekeeper%20Cookie%20(Cookier%20Run),r
Affogato Cookie/Wildberry Cookie | Hollyberry Cookie's Bodyguard (Cookie Run),0,/tags/Affogato%20Cookie*s*Wildberry%20Cookie%20%7C%20Hollyberry%20Cookie's%20Bodyguard%20(Cookie%20Run),r
Black Pearl Cookie & Sorbet Shark Cookie (Cookie Run),0,/tags/Black%20Pearl%20Cookie%20*a*%20Sorbet%20Shark%20Cookie%20(Cookie%20Run),r
Orchid Cookie | Blue Lily Cookie,9,/tags/Orchid%20Cookie%20%7C%20Blue%20Lily%20Cookie,c
Black Pearl Cookie & Squid Ink Cookie (Cookie Run),1,/tags/Black%20Pearl%20Cookie%20*a*%20Squid%20Ink%20Cookie%20(Cookie%20Run),r
Blueberry Cookie/Bumbleberry Cookie (Cookie Run),0,/tags/Blueberry%20Cookie*s*Bumbleberry%20Cookie%20(Cookie%20Run),r
Cream Unicorn Cookie/Whipped Cream Cookie (Cookie Run),0,/tags/Cream%20Unicorn%20Cookie*s*Whipped%20Cream%20Cookie%20(Cookie%20Run),r
Crowberry Cookie/Truffle Cookie (Cookie Run),0,/tags/Crowberry%20Cookie*s*Truffle%20Cookie%20(Cookie%20Run),r
Grand Madeleine Cookie/Light Cream Cookie (Cookie Run),2,/tags/Grand%20Madeleine%20Cookie*s*Light%20Cream%20Cookie%20(Cookie%20Run),r
Alchemist Cookie/Gumball Cookie (Cookie Run),0,/tags/Alchemist%20Cookie*s*Gumball%20Cookie%20(Cookie%20Run),r
Angel Cookie & Ninja Cookie (Cookie Run),0,/tags/Angel%20Cookie%20*a*%20Ninja%20Cookie%20(Cookie%20Run),r
Mala Sauce Cookie/Strawberry Cookie (Cookie Run),0,/tags/Mala%20Sauce%20Cookie*s*Strawberry%20Cookie%20(Cookie%20Run),r
Walnut Cookie (Cookie Run)/Original Character(s),1,/tags/Walnut%20Cookie%20(Cookie%20Run)*s*Original%20Character(s),r
Pizza Cookie & Roll Cake Cookie (Cookie Run),1,/tags/Pizza%20Cookie%20*a*%20Roll%20Cake%20Cookie%20(Cookie%20Run),r
Black Pearl Cookie/Captain Caviar Cookie (Cookie Run),9,/tags/Black%20Pearl%20Cookie*s*Captain%20Caviar%20Cookie%20(Cookie%20Run),r
Captain Caviar Cookie/Clotted Cream Cookie (Cookie Run),3,/tags/Captain%20Caviar%20Cookie*s*Clotted%20Cream%20Cookie%20(Cookie%20Run),r
Captain Caviar Cookie/Clotted Cream Cookie/Oyster Cookie (Cookie Run),1,/tags/Captain%20Caviar%20Cookie*s*Clotted%20Cream%20Cookie*s*Oyster%20Cookie%20(Cookie%20Run),r
Cookie Detective: The Butter Painting Affair Even (Cookie Run),0,/tags/Cookie%20Detective:%20The%20Butter%20Painting%20Affair%20Even%20(Cookie%20Run),f
Black Pearl Cookie & Gumball Cookie (Cookie Run),0,/tags/Black%20Pearl%20Cookie%20*a*%20Gumball%20Cookie%20(Cookie%20Run),r
Candy Diver Cookie & Gumball Cookie (Cookie Run),3,/tags/Candy%20Diver%20Cookie%20*a*%20Gumball%20Cookie%20(Cookie%20Run),r
Captain Caviar Cookie & Gumball Cookie (Cookie Run),0,/tags/Captain%20Caviar%20Cookie%20*a*%20Gumball%20Cookie%20(Cookie%20Run),r
Cream Unicorn Cookie/Vampire Cookie (Cookie Run),2,/tags/Cream%20Unicorn%20Cookie*s*Vampire%20Cookie%20(Cookie%20Run),r
Timekeeper Cookie & Dr. Wasabi Cookie (Cookie Run),0,/tags/Timekeeper%20Cookie%20*a*%20Dr*d*%20Wasabi%20Cookie%20(Cookie%20Run),r
Croissant Cookie/Captain Ice Cookie (Cookie Run),0,/tags/Croissant%20Cookie*s*Captain%20Ice%20Cookie%20(Cookie%20Run),r
Lotus Dragon Cookie/Moonlight Cookie (Cookie Run),3,/tags/Lotus%20Dragon%20Cookie*s*Moonlight%20Cookie%20(Cookie%20Run),r
Republic Sailor Cookie 2 (Cookie Run),16,/tags/Republic%20Sailor%20Cookie%202%20(Cookie%20Run),c
Almond Cookie/Blueberry Pie Cookie (Cookie Run),0,/tags/Almond%20Cookie*s*Blueberry%20Pie%20Cookie%20(Cookie%20Run),r
Captain Caviar Cookie/Republic Sailor Cookie 2 (Cookie Run),5,/tags/Captain%20Caviar%20Cookie*s*Republic%20Sailor%20Cookie%202%20(Cookie%20Run),r
Croissant Cookie (Cookie Run) & Original Character(s),0,/tags/Croissant%20Cookie%20(Cookie%20Run)%20*a*%20Original%20Character(s),r
Knight Cookie & Lotus Dragon Cookie (Cookie Run),0,/tags/Knight%20Cookie%20*a*%20Lotus%20Dragon%20Cookie%20(Cookie%20Run),r
Lychee Dragon Cookie/Wind Archer Cookie (Cookie Run)/You,0,/tags/Lychee%20Dragon%20Cookie*s*Wind%20Archer%20Cookie%20(Cookie%20Run)*s*You,r
Cream Unicorn Cookie/Pastry Cookie (Cookie Run),0,/tags/Cream%20Unicorn%20Cookie*s*Pastry%20Cookie%20(Cookie%20Run),r
Caramel Arrow Cookie & Milk Cookie (Cookie Run),0,/tags/Caramel%20Arrow%20Cookie%20*a*%20Milk%20Cookie%20(Cookie%20Run),r
GingerBrave | Brave Cookie/Gumball Cookie,0,/tags/GingerBrave%20%7C%20Brave%20Cookie*s*Gumball%20Cookie,r
GingerBrave | Brave Cookie & Gumball Cookie,0,/tags/GingerBrave%20%7C%20Brave%20Cookie%20*a*%20Gumball%20Cookie,r
Clotted Cream Cookie/Cream Unicorn Cookie (Cookie Run),0,/tags/Clotted%20Cream%20Cookie*s*Cream%20Unicorn%20Cookie%20(Cookie%20Run),r
Mulled Juice Cookie/Republic Sailor Cookie 2 (Cookie Run),0,/tags/Mulled%20Juice%20Cookie*s*Republic%20Sailor%20Cookie%202%20(Cookie%20Run),r
Lilac Cookie/Whipped Cream Cookie/Yogurt Cream Cookie (Cookie Run),0,/tags/Lilac%20Cookie*s*Whipped%20Cream%20Cookie*s*Yogurt%20Cream%20Cookie%20(Cookie%20Run),r
Onion Cookie & Strawberry Crepe Cookie (Cookie Run),1,/tags/Onion%20Cookie%20*a*%20Strawberry%20Crepe%20Cookie%20(Cookie%20Run),r
Lychee Dragon Cookie & Strawberry Crepe Cookie (Cookie Run),1,/tags/Lychee%20Dragon%20Cookie%20*a*%20Strawberry%20Crepe%20Cookie%20(Cookie%20Run),r
Truffle and Pumpkin Pie Cookie's 2022 Frightfest (Cookie Run),0,/tags/Truffle%20and%20Pumpkin%20Pie%20Cookie's%202022%20Frightfest%20(Cookie%20Run),f
Adventurer Cookie/Muscle Cookie (Cookie Run),0,/tags/Adventurer%20Cookie*s*Muscle%20Cookie%20(Cookie%20Run),r
Dino-Sour Cookie/Dozer Cookie (Cookie Run),0,/tags/Dino-Sour%20Cookie*s*Dozer%20Cookie%20(Cookie%20Run),r
Cyborg Cookie/Knight Cookie (Cookie Run),1,/tags/Cyborg%20Cookie*s*Knight%20Cookie%20(Cookie%20Run),r
Fig Cookie/Whipped Cream Cookie (Cookie Run),1,/tags/Fig%20Cookie*s*Whipped%20Cream%20Cookie%20(Cookie%20Run),r
Almond Cookie/Chocolate Bonbon Cookie (Cookie Run),0,/tags/Almond%20Cookie*s*Chocolate%20Bonbon%20Cookie%20(Cookie%20Run),r
Okchun Cookie (Cookie Run),2,/tags/Okchun%20Cookie%20(Cookie%20Run),c
Butter Tiger (Cookie Run),4,/tags/Butter%20Tiger%20(Cookie%20Run),c
Akamatsu Kaede/Pomegranate Cookie (Cookie Run),1,/tags/Akamatsu%20Kaede*s*Pomegranate%20Cookie%20(Cookie%20Run),r
Emo GingerBrave | Brave Cookie,2,/tags/Emo%20GingerBrave%20%7C%20Brave%20Cookie,f
Custard Cookie | Head of House Custard & Original Character(s),6,/tags/Custard%20Cookie%20%7C%20Head%20of%20House%20Custard%20*a*%20Original%20Character(s),r
Finn the Human & GingerBrave | Brave Cookie,0,/tags/Finn%20the%20Human%20*a*%20GingerBrave%20%7C%20Brave%20Cookie,r
Candy Diver Cookie & Squid Ink Cookie (Cookie Run),1,/tags/Candy%20Diver%20Cookie%20*a*%20Squid%20Ink%20Cookie%20(Cookie%20Run),r
Candy Diver Cookie & Captain Caviar Cookie (Cookie Run),3,/tags/Candy%20Diver%20Cookie%20*a*%20Captain%20Caviar%20Cookie%20(Cookie%20Run),r
Fig Cookie/Orange Cookie (Cookie Run),1,/tags/Fig%20Cookie*s*Orange%20Cookie%20(Cookie%20Run),r
Custard Cookie | Head of House Custard/Oyster Cookie,1,/tags/Custard%20Cookie%20%7C%20Head%20of%20House%20Custard*s*Oyster%20Cookie,r
Black Pearl Cookie & Sea Fairy Cookie (Cookie Run),0,/tags/Black%20Pearl%20Cookie%20*a*%20Sea%20Fairy%20Cookie%20(Cookie%20Run),r
Black Pearl Cookie & Frost Queen Cookie & Sea Fairy Cookie (Cookie Run),1,/tags/Black%20Pearl%20Cookie%20*a*%20Frost%20Queen%20Cookie%20*a*%20Sea%20Fairy%20Cookie%20(Cookie%20Run),r
Rockstar Cookie/Toothpaste Cookie (Cookie Run),0,/tags/Rockstar%20Cookie*s*Toothpaste%20Cookie%20(Cookie%20Run),r
Aloe Cookie (Cookie Run) & Antisepticeye (Jacksepticeye) & Kenny McCormick & Nisshii | Barold,1,/tags/Aloe%20Cookie%20(Cookie%20Run)%20*a*%20Antisepticeye%20(Jacksepticeye)%20*a*%20Kenny%20McCormick%20*a*%20Nisshii%20%7C%20Barold,r
Churro Cookie & Wind Archer Cookie (Cookie Run),1,/tags/Churro%20Cookie%20*a*%20Wind%20Archer%20Cookie%20(Cookie%20Run),r
Espresso Cookie & Gumball Cookie (Cookie Run),0,/tags/Espresso%20Cookie%20*a*%20Gumball%20Cookie%20(Cookie%20Run),r
Longan Dragon Cookie/White Lily Cookie | Saint Lily Cookie,0,/tags/Longan%20Dragon%20Cookie*s*White%20Lily%20Cookie%20%7C%20Saint%20Lily%20Cookie,r
Affogato Cookie/Tiger Lily Cookie (Cookie Run),1,/tags/Affogato%20Cookie*s*Tiger%20Lily%20Cookie%20(Cookie%20Run),r
Affogato Cookie & Tiger Lily Cookie (Cookie Run),0,/tags/Affogato%20Cookie%20*a*%20Tiger%20Lily%20Cookie%20(Cookie%20Run),r
Lilybell Cookie & Millennial Tree Cookie (Cookie Run),1,/tags/Lilybell%20Cookie%20*a*%20Millennial%20Tree%20Cookie%20(Cookie%20Run),r
Republic Sailor Cookie 2 (Cookie Run)/Original Female Character(s),0,/tags/Republic%20Sailor%20Cookie%202%20(Cookie%20Run)*s*Original%20Female%20Character(s),r
Black Raisin Cookie & Licorice Cookie (Cookie Run),2,/tags/Black%20Raisin%20Cookie%20*a*%20Licorice%20Cookie%20(Cookie%20Run),r
Cherry Blossom Cookie & Sparkling Cookie (Cookie Run),1,/tags/Cherry%20Blossom%20Cookie%20*a*%20Sparkling%20Cookie%20(Cookie%20Run),r
Living Licorice Abyss (Cookie Run),2,/tags/Living%20Licorice%20Abyss%20(Cookie%20Run),c
Mille-Feuille Cookie (Cookie Run) & Original Character(s),0,/tags/Mille-Feuille%20Cookie%20(Cookie%20Run)%20*a*%20Original%20Character(s),r
Red Velvet Cookie (Cookie Run)/Original Female Character(s),3,/tags/Red%20Velvet%20Cookie%20(Cookie%20Run)*s*Original%20Female%20Character(s),r
Fig Cookie & Roguefort Cookie (Cookie Run),1,/tags/Fig%20Cookie%20*a*%20Roguefort%20Cookie%20(Cookie%20Run),r
Black Pearl Cookie (Cookie Run)/Miyuki (Yandere Simulator),0,/tags/Black%20Pearl%20Cookie%20(Cookie%20Run)*s*Miyuki%20(Yandere%20Simulator),r
Herb Cookie & Millennial Tree Cookie & Wind Archer Cookie (Cookie Run),1,/tags/Herb%20Cookie%20*a*%20Millennial%20Tree%20Cookie%20*a*%20Wind%20Archer%20Cookie%20(Cookie%20Run),r
Dark Cacao Cookie/Longan Dragon Cookie (Cookie Run),1,/tags/Dark%20Cacao%20Cookie*s*Longan%20Dragon%20Cookie%20(Cookie%20Run),r
Parfait Cookie/Werewolf Cookie (Cookie Run),1,/tags/Parfait%20Cookie*s*Werewolf%20Cookie%20(Cookie%20Run),r
Jung Kook Cookie (Cookie Run),5,/tags/Jung%20Kook%20Cookie%20(Cookie%20Run),c
Lemon Cookie (Cookie Run)/You,0,/tags/Lemon%20Cookie%20(Cookie%20Run)*s*You,r
String Gummy Cookie & Twizzly Gummy Cookie (Cookie Run),1,/tags/String%20Gummy%20Cookie%20*a*%20Twizzly%20Gummy%20Cookie%20(Cookie%20Run),r
Jung Kook Cookie/Milk Cookie (Cookie Run),1,/tags/Jung%20Kook%20Cookie*s*Milk%20Cookie%20(Cookie%20Run),r
Chess Choco Cookie (Cookie Run) & Original Character(s),0,/tags/Chess%20Choco%20Cookie%20(Cookie%20Run)%20*a*%20Original%20Character(s),r
Cherry Cookie & Custard Cookie III (Cookie Run),0,/tags/Cherry%20Cookie%20*a*%20Custard%20Cookie%20III%20(Cookie%20Run),r
V Cookie (Cookie Run),2,/tags/V%20Cookie%20(Cookie%20Run),c
Knight Cookie & V Cookie (Cookie Run),0,/tags/Knight%20Cookie%20*a*%20V%20Cookie%20(Cookie%20Run),r
Patch 3.8: Braver Together (BTS and Cookie Run: Kingdom),0,/tags/Patch%203*d*8:%20Braver%20Together%20(BTS%20and%20Cookie%20Run:%20Kingdom),f
Pizza Cookie (Cookie Run) & Ultraman Orb,0,/tags/Pizza%20Cookie%20(Cookie%20Run)%20*a*%20Ultraman%20Orb,r
Millennial Tree Cookie/Whipped Cream Cookie (Cookie Run),2,/tags/Millennial%20Tree%20Cookie*s*Whipped%20Cream%20Cookie%20(Cookie%20Run),r
Cream Unicorn Cookie/Fig Cookie (Cookie Run),1,/tags/Cream%20Unicorn%20Cookie*s*Fig%20Cookie%20(Cookie%20Run),r
Hollyberry Cookie (Cookie Run) & Original Character(s),0,/tags/Hollyberry%20Cookie%20(Cookie%20Run)%20*a*%20Original%20Character(s),r
Cream Unicorn Cookie/Strawberry Crepe Cookie (Cookie Run),0,/tags/Cream%20Unicorn%20Cookie*s*Strawberry%20Crepe%20Cookie%20(Cookie%20Run),r
Clotted Cream Cookie/Strawberry Crepe Cookie (Cookie Run),0,/tags/Clotted%20Cream%20Cookie*s*Strawberry%20Crepe%20Cookie%20(Cookie%20Run),r
Alchemist Cookie/Almond Cookie (Cookie Run),0,/tags/Alchemist%20Cookie*s*Almond%20Cookie%20(Cookie%20Run),r
Earl Grey Cookie/Fig Cookie (Cookie Run),3,/tags/Earl%20Grey%20Cookie*s*Fig%20Cookie%20(Cookie%20Run),r
Cinnamon Cookie/Knight Cookie (Cookie Run),0,/tags/Cinnamon%20Cookie*s*Knight%20Cookie%20(Cookie%20Run),r
Lilybell Cookie & Orchid Cookie | Blue Lily Cookie,0,/tags/Lilybell%20Cookie%20*a*%20Orchid%20Cookie%20%7C%20Blue%20Lily%20Cookie,r
Herb Cookie & Matcha Cookie (Cookie Run),0,/tags/Herb%20Cookie%20*a*%20Matcha%20Cookie%20(Cookie%20Run),r
Orchid Cookie | Blue Lily Cookie & White LIly Cookie | Saint Lily Cookie,0,/tags/Orchid%20Cookie%20%7C%20Blue%20Lily%20Cookie%20*a*%20White%20LIly%20Cookie%20%7C%20Saint%20Lily%20Cookie,r
Lilybell Cookie & White LIly Cookie | Saint Lily Cookie,3,/tags/Lilybell%20Cookie%20*a*%20White%20LIly%20Cookie%20%7C%20Saint%20Lily%20Cookie,r
Penny Fitzgerald & Strawberry Cookie (Cookie Run),0,/tags/Penny%20Fitzgerald%20*a*%20Strawberry%20Cookie%20(Cookie%20Run),r
Chili Pepper Cookie & Dark Choco Cookie (Cookie Run),1,/tags/Chili%20Pepper%20Cookie%20*a*%20Dark%20Choco%20Cookie%20(Cookie%20Run),r
Caramel Arrow Cookie/Peach Cookie (Cookie Run),2,/tags/Caramel%20Arrow%20Cookie*s*Peach%20Cookie%20(Cookie%20Run),r
Crunchy Chip Cookie & Financier Cookie (Cookie Run),1,/tags/Crunchy%20Chip%20Cookie%20*a*%20Financier%20Cookie%20(Cookie%20Run),r
