tag,count,href,category
Espresso Cookie & Pure Vanilla Cookie (Cookie Run),4,/tags/Espresso%20Cookie%20*a*%20Pure%20Vanilla%20Cookie%20(Cookie%20Run),r
Avocado Cookie/Parfait Cookie (Cookie Run),0,/tags/Avocado%20Cookie*s*Parfait%20Cookie%20(Cookie%20Run),r
Devil Cookie (Cookie Run)/Other(s),0,/tags/Devil%20Cookie%20(Cookie%20Run)*s*Other(s),r
Orange Cookie (Cookie Run)/Original Character(s),0,/tags/Orange%20Cookie%20(Cookie%20Run)*s*Original%20Character(s),r
Licorice Cookie & Pure Vanilla Cookie (Cookie Run),1,/tags/Licorice%20Cookie%20*a*%20Pure%20Vanilla%20Cookie%20(Cookie%20Run),r
Dark Cacao Cookie & Golden Cheese Cookie & Hollyberry Cookie (Cookie Run),3,/tags/Dark%20Cacao%20Cookie%20*a*%20Golden%20Cheese%20Cookie%20*a*%20Hollyberry%20Cookie%20(Cookie%20Run),r
Licorice Cookie/Madeleine Cookie (Cookie Run),5,/tags/Licorice%20Cookie*s*Madeleine%20Cookie%20(Cookie%20Run),r
Herb Cookie/Sparkling Cookie/Vampire Cookie (Cookie Run),14,/tags/Herb%20Cookie*s*Sparkling%20Cookie*s*Vampire%20Cookie%20(Cookie%20Run),r
Cream Unicorn Cookie/Pure Vanilla Cookie (Cookie Run),0,/tags/Cream%20Unicorn%20Cookie*s*Pure%20Vanilla%20Cookie%20(Cookie%20Run),r
Licorice Cookie & Red Velvet Cookie (Cookie Run),7,/tags/Licorice%20Cookie%20*a*%20Red%20Velvet%20Cookie%20(Cookie%20Run),r
Licorice Cookie & Pomegranate Cookie (Cookie Run),26,/tags/Licorice%20Cookie%20*a*%20Pomegranate%20Cookie%20(Cookie%20Run),r
Dark Cacao Cookie/Dark Choco Cookie (Cookie Run),66,/tags/Dark%20Cacao%20Cookie*s*Dark%20Choco%20Cookie%20(Cookie%20Run),r
Licorice Cookie (Cookie Run) & Original Character(s),4,/tags/Licorice%20Cookie%20(Cookie%20Run)%20*a*%20Original%20Character(s),r
Earl Grey Cookie & Licorice Cookie (Cookie Run),0,/tags/Earl%20Grey%20Cookie%20*a*%20Licorice%20Cookie%20(Cookie%20Run),r
Espresso Cookie/Lilac Cookie (Cookie Run),3,/tags/Espresso%20Cookie*s*Lilac%20Cookie%20(Cookie%20Run),r
Cookiesnap/Herb Cookie (Cookie Run),1,/tags/Cookiesnap*s*Herb%20Cookie%20(Cookie%20Run),r
Earl Grey Cookie/Roguefort Cookie (Cookie Run),3,/tags/Earl%20Grey%20Cookie*s*Roguefort%20Cookie%20(Cookie%20Run),r
Custard Cookie III & Devil Cookie (Cookie Run),0,/tags/Custard%20Cookie%20III%20*a*%20Devil%20Cookie%20(Cookie%20Run),r
Adventurer Cookie & Onion Cookie (Cookie Run),4,/tags/Adventurer%20Cookie%20*a*%20Onion%20Cookie%20(Cookie%20Run),r
Clover Cookie/Herb Cookie/Licorice Cookie/Vampire Cookie (Cookie Run),0,/tags/Clover%20Cookie*s*Herb%20Cookie*s*Licorice%20Cookie*s*Vampire%20Cookie%20(Cookie%20Run),r
Sugar Glass Cookie (Cookie Run)/Original Character(s),0,/tags/Sugar%20Glass%20Cookie%20(Cookie%20Run)*s*Original%20Character(s),r
Maestro Sugar Gnome (Cookie Run),1,/tags/Maestro%20Sugar%20Gnome%20(Cookie%20Run),c
Millennial Tree Cookie & Sugar Swan & Wind Archer Cookie (Cookie Run),0,/tags/Millennial%20Tree%20Cookie%20*a*%20Sugar%20Swan%20*a*%20Wind%20Archer%20Cookie%20(Cookie%20Run),r
Avocado Cookie/Mala Sauce Cookie (Cookie Run),2,/tags/Avocado%20Cookie*s*Mala%20Sauce%20Cookie%20(Cookie%20Run),r
Rye Cookie/White Choco Cookie (Cookie Run),0,/tags/Rye%20Cookie*s*White%20Choco%20Cookie%20(Cookie%20Run),r
Bat-Cat & Licorice Cookie (Cookie Run),3,/tags/Bat-Cat%20*a*%20Licorice%20Cookie%20(Cookie%20Run),r
Chili Pepper Cookie/Raspberry Cookie (Cookie Run),1,/tags/Chili%20Pepper%20Cookie*s*Raspberry%20Cookie%20(Cookie%20Run),r
Custard Cookie III/Poison Mushroom Cookie (Cookie Run),4,/tags/Custard%20Cookie%20III*s*Poison%20Mushroom%20Cookie%20(Cookie%20Run),r
Almond Cookie (Cookie Run)/Other(s),0,/tags/Almond%20Cookie%20(Cookie%20Run)*s*Other(s),r
Clover Cookie/Espresso Cookie (Cookie Run),3,/tags/Clover%20Cookie*s*Espresso%20Cookie%20(Cookie%20Run),r
Lilac Cookie (Cookie Run)/Everyone,0,/tags/Lilac%20Cookie%20(Cookie%20Run)*s*Everyone,r
Clover Cookie/Lilac Cookie (Cookie Run),0,/tags/Clover%20Cookie*s*Lilac%20Cookie%20(Cookie%20Run),r
Herb Cookie (Cookie Run)/Other(s),0,/tags/Herb%20Cookie%20(Cookie%20Run)*s*Other(s),r
Red Velvet Cookie & Vampire Cookie (Cookie Run),0,/tags/Red%20Velvet%20Cookie%20*a*%20Vampire%20Cookie%20(Cookie%20Run),r
Cheerleader Cookie & Mustard Cookie (Cookie Run),0,/tags/Cheerleader%20Cookie%20*a*%20Mustard%20Cookie%20(Cookie%20Run),r
Espresso Cookie (Cookie Run) & Original Character(s),3,/tags/Espresso%20Cookie%20(Cookie%20Run)%20*a*%20Original%20Character(s),r
Cheerleader Cookie/Hero Cookie (Cookie Run),1,/tags/Cheerleader%20Cookie*s*Hero%20Cookie%20(Cookie%20Run),r
Dino-Sour Cookie/Tiger Lily Cookie (Cookie Run),0,/tags/Dino-Sour%20Cookie*s*Tiger%20Lily%20Cookie%20(Cookie%20Run),r
Almond Cookie & Butter Pretzel Cookie (Cookie Run),0,/tags/Almond%20Cookie%20*a*%20Butter%20Pretzel%20Cookie%20(Cookie%20Run),r
Earl Grey Cookie (Cookie Run) & Original Character(s),0,/tags/Earl%20Grey%20Cookie%20(Cookie%20Run)%20*a*%20Original%20Character(s),r
Espresso Cookie & Madeleine Cookie (Cookie Run) & Original Character(s),1,/tags/Espresso%20Cookie%20*a*%20Madeleine%20Cookie%20(Cookie%20Run)%20*a*%20Original%20Character(s),r
Dark Enchantress Cookie & Licorice Cookie (Cookie Run),9,/tags/Dark%20Enchantress%20Cookie%20*a*%20Licorice%20Cookie%20(Cookie%20Run),r
Espresso Cookie/Licorice Cookie/Madeleine Cookie (Cookie Run),0,/tags/Espresso%20Cookie*s*Licorice%20Cookie*s*Madeleine%20Cookie%20(Cookie%20Run),r
Licorice Cooke & Strawberry Crepe Cookie (Cookie Run),3,/tags/Licorice%20Cooke%20*a*%20Strawberry%20Crepe%20Cookie%20(Cookie%20Run),r
Lobster Cookie (Cookie Run)/Original Character(s),0,/tags/Lobster%20Cookie%20(Cookie%20Run)*s*Original%20Character(s),r
Beet Cookie & Carrot Cookie (Cookie Run),0,/tags/Beet%20Cookie%20*a*%20Carrot%20Cookie%20(Cookie%20Run),r
Madeleine Cookie (Cookie Run)/Original Character(s),1,/tags/Madeleine%20Cookie%20(Cookie%20Run)*s*Original%20Character(s),r
Blackberry Cookie/Chili Pepper Cookie (Cookie Run),1,/tags/Blackberry%20Cookie*s*Chili%20Pepper%20Cookie%20(Cookie%20Run),r
Chili Pepper Cookie & GingerBrave | Brave Cookie,3,/tags/Chili%20Pepper%20Cookie%20*a*%20GingerBrave%20%7C%20Brave%20Cookie,r
Earl Grey Cookie/Espresso Cookie (Cookie Run),0,/tags/Earl%20Grey%20Cookie*s*Espresso%20Cookie%20(Cookie%20Run),r
Black Raisin Cookie/Pastry Cookie (Cookie Run),11,/tags/Black%20Raisin%20Cookie*s*Pastry%20Cookie%20(Cookie%20Run),r
Earl Grey Cookie/Lobster Cookie (Cookie Run),0,/tags/Earl%20Grey%20Cookie*s*Lobster%20Cookie%20(Cookie%20Run),r
Ananas Dragon Cookie & Lotus Dragon Cookie (Cookie Run),0,/tags/Ananas%20Dragon%20Cookie%20*a*%20Lotus%20Dragon%20Cookie%20(Cookie%20Run),r
Blackberry Cookie/Onion Cookie (Cookie Run),0,/tags/Blackberry%20Cookie*s*Onion%20Cookie%20(Cookie%20Run),r
Beet Cookie & Herb Cookie (Cookie Run),0,/tags/Beet%20Cookie%20*a*%20Herb%20Cookie%20(Cookie%20Run),r
Lilac Cookie (Cookie Run)/Original Character(s),0,/tags/Lilac%20Cookie%20(Cookie%20Run)*s*Original%20Character(s),r
Lilac Cookie/Sparkling Cookie (Cookie Run),2,/tags/Lilac%20Cookie*s*Sparkling%20Cookie%20(Cookie%20Run),r
Butter Pretzel Cookie/Pastry Cookie (Cookie Run),1,/tags/Butter%20Pretzel%20Cookie*s*Pastry%20Cookie%20(Cookie%20Run),r
Knight Cookie & Madeleine Cookie (Cookie Run),8,/tags/Knight%20Cookie%20*a*%20Madeleine%20Cookie%20(Cookie%20Run),r
Madeleine Cookie & Parfait Cookie (Cookie Run),1,/tags/Madeleine%20Cookie%20*a*%20Parfait%20Cookie%20(Cookie%20Run),r
Mont Blanc Cookie (Cookie Run),14,/tags/Mont%20Blanc%20Cookie%20(Cookie%20Run),c
Licorice Cookie & Madeleine Cookie (Cookie Run),4,/tags/Licorice%20Cookie%20*a*%20Madeleine%20Cookie%20(Cookie%20Run),r
Black Raisin Cookie & Pure Vanilla Cookie (Cookie Run),21,/tags/Black%20Raisin%20Cookie%20*a*%20Pure%20Vanilla%20Cookie%20(Cookie%20Run),r
Custard Cookie III/Pure Vanilla Cookie (Cookie Run),8,/tags/Custard%20Cookie%20III*s*Pure%20Vanilla%20Cookie%20(Cookie%20Run),r
Custard Cookie III & Onion Cookie (Cookie Run),3,/tags/Custard%20Cookie%20III%20*a*%20Onion%20Cookie%20(Cookie%20Run),r
Poison Mushroom Cookie & Strawberry Crepe Cookie (Cookie Run),6,/tags/Poison%20Mushroom%20Cookie%20*a*%20Strawberry%20Crepe%20Cookie%20(Cookie%20Run),r
Milk Cookie & Red Velvet Cookie (Cookie Run),2,/tags/Milk%20Cookie%20*a*%20Red%20Velvet%20Cookie%20(Cookie%20Run),r
Beet Cookie & Custard Cookie III (Cookie Run),0,/tags/Beet%20Cookie%20*a*%20Custard%20Cookie%20III%20(Cookie%20Run),r
Pumpkin Pie Cookie & Onion Cookie (Cookie Run),5,/tags/Pumpkin%20Pie%20Cookie%20*a*%20Onion%20Cookie%20(Cookie%20Run),r
Clover Cookie/Licorice Cookie/Mint Choco Cookie (Cookie Run),0,/tags/Clover%20Cookie*s*Licorice%20Cookie*s*Mint%20Choco%20Cookie%20(Cookie%20Run),r
Pancake Cookie & Pumpkin Pie Cookie (Cookie Run),0,/tags/Pancake%20Cookie%20*a*%20Pumpkin%20Pie%20Cookie%20(Cookie%20Run),r
Pure Vanilla Cookie/Red Velvet Cookie (Cookie Run),8,/tags/Pure%20Vanilla%20Cookie*s*Red%20Velvet%20Cookie%20(Cookie%20Run),r
Knight Cookie/Princess Cookie/Raspberry Cookie (Cookie Run),0,/tags/Knight%20Cookie*s*Princess%20Cookie*s*Raspberry%20Cookie%20(Cookie%20Run),r
Clover Cookie/Herb Cookie/Mint Choco Cookie (Cookie Run),6,/tags/Clover%20Cookie*s*Herb%20Cookie*s*Mint%20Choco%20Cookie%20(Cookie%20Run),r
Moon Rabbit Cookie & Pumpkin Pie Cookie & Sorbet Shark Cookie & Strawberry Crepe Cookie (Cookie Run),0,/tags/Moon%20Rabbit%20Cookie%20*a*%20Pumpkin%20Pie%20Cookie%20*a*%20Sorbet%20Shark%20Cookie%20*a*%20Strawberry%20Crepe%20Cookie%20(Cookie%20Run),r
Onion Cookie & Pancake Cookie (Cookie Run),3,/tags/Onion%20Cookie%20*a*%20Pancake%20Cookie%20(Cookie%20Run),r
Licorice Cookie & Moonlight Cookie (Cookie Run),0,/tags/Licorice%20Cookie%20*a*%20Moonlight%20Cookie%20(Cookie%20Run),r
Parfait Cookie/Raspberry Cookie (Cookie Run),19,/tags/Parfait%20Cookie*s*Raspberry%20Cookie%20(Cookie%20Run),r
Blackberry Cookie/Parfait Cookie (Cookie Run),0,/tags/Blackberry%20Cookie*s*Parfait%20Cookie%20(Cookie%20Run),r
Plum Cookie (Cookie Run)/Original Character(s),0,/tags/Plum%20Cookie%20(Cookie%20Run)*s*Original%20Character(s),r
Chili Pepper Cookie/Clover Cookie (Cookie Run),0,/tags/Chili%20Pepper%20Cookie*s*Clover%20Cookie%20(Cookie%20Run),r
Espresso Cookie & Onion Cookie (Cookie Run),1,/tags/Espresso%20Cookie%20*a*%20Onion%20Cookie%20(Cookie%20Run),r
Mentioned Vampire Cookie (Cookie Run),5,/tags/Mentioned%20Vampire%20Cookie%20(Cookie%20Run),f
Red Velvet Cookie (Cookie Run) & Original Character(s),5,/tags/Red%20Velvet%20Cookie%20(Cookie%20Run)%20*a*%20Original%20Character(s),r
Raspberry Mousse Cookie/Rose Cookie/Whipped Cream Cookie (Cookie Run),0,/tags/Raspberry%20Mousse%20Cookie*s*Rose%20Cookie*s*Whipped%20Cream%20Cookie%20(Cookie%20Run),r
Lilac Cookie/Werewolf Cookie (Cookie Run),0,/tags/Lilac%20Cookie*s*Werewolf%20Cookie%20(Cookie%20Run),r
Princess Cookie/Raspberry Cookie (Cookie Run),7,/tags/Princess%20Cookie*s*Raspberry%20Cookie%20(Cookie%20Run),r
Butter Pretzel Cookie/Timekeeper Cookie (Cookie Run),1,/tags/Butter%20Pretzel%20Cookie*s*Timekeeper%20Cookie%20(Cookie%20Run),r
Herb Cookie & Red Velvet Cookie (Cookie Run),0,/tags/Herb%20Cookie%20*a*%20Red%20Velvet%20Cookie%20(Cookie%20Run),r
Beet Cookie & Squid Ink Cookie (Cookie Run),0,/tags/Beet%20Cookie%20*a*%20Squid%20Ink%20Cookie%20(Cookie%20Run),r
Almond Cookie & Espresso Cookie & Madeleine Cookie (Cookie Run),0,/tags/Almond%20Cookie%20*a*%20Espresso%20Cookie%20*a*%20Madeleine%20Cookie%20(Cookie%20Run),r
Almond Cookie/Espresso Cookie/Madeleine Cookie (Cookie Run),0,/tags/Almond%20Cookie*s*Espresso%20Cookie*s*Madeleine%20Cookie%20(Cookie%20Run),r
Chili Pepper Cookie/Raspberry Cookie/Twizzly Gummy Cookie (Cookie Run),1,/tags/Chili%20Pepper%20Cookie*s*Raspberry%20Cookie*s*Twizzly%20Gummy%20Cookie%20(Cookie%20Run),r
Aloe Cookie & Bell Pepper Cookie & Croissant Cookie & Hero Cookie (Cookie Run),0,/tags/Aloe%20Cookie%20*a*%20Bell%20Pepper%20Cookie%20*a*%20Croissant%20Cookie%20*a*%20Hero%20Cookie%20(Cookie%20Run),r
Red Velvet Cookie & Sorbet Shark Cookie (Cookie Run),0,/tags/Red%20Velvet%20Cookie%20*a*%20Sorbet%20Shark%20Cookie%20(Cookie%20Run),r
Earl Grey Cookie/Licorice Cookie (Cookie Run),1,/tags/Earl%20Grey%20Cookie*s*Licorice%20Cookie%20(Cookie%20Run),r
Dark Enchantress Cookie/Dr. Wasabi Cookie (Cookie Run),0,/tags/Dark%20Enchantress%20Cookie*s*Dr*d*%20Wasabi%20Cookie%20(Cookie%20Run),r
Herb Cookie/Pancake Cookie (Cookie Run),0,/tags/Herb%20Cookie*s*Pancake%20Cookie%20(Cookie%20Run),r
Pancake Cookie & Pure Vanilla Cookie (Cookie Run),0,/tags/Pancake%20Cookie%20*a*%20Pure%20Vanilla%20Cookie%20(Cookie%20Run),r
Adventurer Cookie/Ninja Cookie (Cookie Run),0,/tags/Adventurer%20Cookie*s*Ninja%20Cookie%20(Cookie%20Run),r
Knight Cookie/Red Velvet Cookie (Cookie Run),0,/tags/Knight%20Cookie*s*Red%20Velvet%20Cookie%20(Cookie%20Run),r
Ninja Cookie & Raspberry Cookie (Cookie Run),1,/tags/Ninja%20Cookie%20*a*%20Raspberry%20Cookie%20(Cookie%20Run),r
Pomegranate Cookie (Cookie Run)/Original Character(s),0,/tags/Pomegranate%20Cookie%20(Cookie%20Run)*s*Original%20Character(s),r
Madeleine Cookie (Cookie Run) & Undisclosed,0,/tags/Madeleine%20Cookie%20(Cookie%20Run)%20*a*%20Undisclosed,r
Madeleine Cookie (Cookie Run)/Undisclosed,0,/tags/Madeleine%20Cookie%20(Cookie%20Run)*s*Undisclosed,r
Raspberry Cookie & Raspberry Mousse Cookie (Cookie Run),15,/tags/Raspberry%20Cookie%20*a*%20Raspberry%20Mousse%20Cookie%20(Cookie%20Run),r
Peach Cookie/Red Pepper Cookie (Cookie Run),0,/tags/Peach%20Cookie*s*Red%20Pepper%20Cookie%20(Cookie%20Run),r
Licorice Cookie/Onion Cookie (Cookie Run),1,/tags/Licorice%20Cookie*s*Onion%20Cookie%20(Cookie%20Run),r
Butter Pretzel Cookie & Roguefort Cookie (Cookie Run),0,/tags/Butter%20Pretzel%20Cookie%20*a*%20Roguefort%20Cookie%20(Cookie%20Run),r
Strawberry Crepe Cookie & Tails Cookie (Cookie Run),0,/tags/Strawberry%20Crepe%20Cookie%20*a*%20Tails%20Cookie%20(Cookie%20Run),r
Chocolate Bonbon Cookie & Sour Belt Cookie (Cookie Run),2,/tags/Chocolate%20Bonbon%20Cookie%20*a*%20Sour%20Belt%20Cookie%20(Cookie%20Run),r
Raspberry Cookie/Twizzly Gummy Cookie (Cookie Run),1,/tags/Raspberry%20Cookie*s*Twizzly%20Gummy%20Cookie%20(Cookie%20Run),r
Toothpaste Cookie/Twizzly Gummy Cookie (Cookie Run),0,/tags/Toothpaste%20Cookie*s*Twizzly%20Gummy%20Cookie%20(Cookie%20Run),r
Custard Cookie III & Vampire Cookie (Cookie Run),0,/tags/Custard%20Cookie%20III%20*a*%20Vampire%20Cookie%20(Cookie%20Run),r
Latte Cookie & Sorbet Shark Cookie (Cookie Run),0,/tags/Latte%20Cookie%20*a*%20Sorbet%20Shark%20Cookie%20(Cookie%20Run),r
Hollyberry Cookie & Sorbet Shark Cookie (Cookie Run),1,/tags/Hollyberry%20Cookie%20*a*%20Sorbet%20Shark%20Cookie%20(Cookie%20Run),r
Pure Vanilla Cookie & Strawberry Crepe Cookie (Cookie Run),8,/tags/Pure%20Vanilla%20Cookie%20*a*%20Strawberry%20Crepe%20Cookie%20(Cookie%20Run),r
Strawberry Cookie/Wizard Cookie (Cookie Run),5,/tags/Strawberry%20Cookie*s*Wizard%20Cookie%20(Cookie%20Run),r
Chili Pepper Cookie & Sparkling Cookie (Cookie Run),0,/tags/Chili%20Pepper%20Cookie%20*a*%20Sparkling%20Cookie%20(Cookie%20Run),r
Scorpion Cookie & Yogurt Cream Cookie (Cookie Run),3,/tags/Scorpion%20Cookie%20*a*%20Yogurt%20Cream%20Cookie%20(Cookie%20Run),r
Licorice Cookie/Zombie Cookie (Cookie Run),0,/tags/Licorice%20Cookie*s*Zombie%20Cookie%20(Cookie%20Run),r
Captain Ice Cookie/Pirate Cookie/Salt Cookie (Cookie Run),0,/tags/Captain%20Ice%20Cookie*s*Pirate%20Cookie*s*Salt%20Cookie%20(Cookie%20Run),r
Roguefort Cookie (Cookie Run) & Original Character(s),1,/tags/Roguefort%20Cookie%20(Cookie%20Run)%20*a*%20Original%20Character(s),r
Almond Cookie (Cookie Run)/Dazai Osamu (Bungou Stray Dogs),0,/tags/Almond%20Cookie%20(Cookie%20Run)*s*Dazai%20Osamu%20(Bungou%20Stray%20Dogs),r
Licorice Cookie/Pomegranate Cookie/Red Velvet Cookie (Cookie Run),1,/tags/Licorice%20Cookie*s*Pomegranate%20Cookie*s*Red%20Velvet%20Cookie%20(Cookie%20Run),r
Hollyberry Cookie & Golden Cheese Cookie (Cookie Run ),3,/tags/Hollyberry%20Cookie%20*a*%20Golden%20Cheese%20Cookie%20(Cookie%20Run%20),r
Captain Ice Cookie & Pirate Cookie (Cookie Run),6,/tags/Captain%20Ice%20Cookie%20*a*%20Pirate%20Cookie%20(Cookie%20Run),r
Dino-Sour Cookie & Milk Cookie (Cookie Run),2,/tags/Dino-Sour%20Cookie%20*a*%20Milk%20Cookie%20(Cookie%20Run),r
Mala Sauce Cookie & Milk Cookie (Cookie Run),3,/tags/Mala%20Sauce%20Cookie%20*a*%20Milk%20Cookie%20(Cookie%20Run),r
Dino-Sour Cookie & Purple Yam Cookie (Cookie Run),1,/tags/Dino-Sour%20Cookie%20*a*%20Purple%20Yam%20Cookie%20(Cookie%20Run),r
Dino-Sour Cookie & Mala Sauce Cookie (Cookie Run),1,/tags/Dino-Sour%20Cookie%20*a*%20Mala%20Sauce%20Cookie%20(Cookie%20Run),r
Mala Sauce Cookie & Purple Yam Cookie (Cookie Run),4,/tags/Mala%20Sauce%20Cookie%20*a*%20Purple%20Yam%20Cookie%20(Cookie%20Run),r
Sour Belt Cookie (Cookie Run)/X (Battle For Dream Island),1,/tags/Sour%20Belt%20Cookie%20(Cookie%20Run)*s*X%20(Battle%20For%20Dream%20Island),r
Sorbet Shark Cookie/Strawberry Crepe Cookie (Cookie Run),3,/tags/Sorbet%20Shark%20Cookie*s*Strawberry%20Crepe%20Cookie%20(Cookie%20Run),r
Sorbet Shark Cookie & Strawberry Crepe Cookie (Cookie Run),2,/tags/Sorbet%20Shark%20Cookie%20*a*%20Strawberry%20Crepe%20Cookie%20(Cookie%20Run),r
Hollyberry Cookie/Golden Cheese Cookie (Cookie Run),20,/tags/Hollyberry%20Cookie*s*Golden%20Cheese%20Cookie%20(Cookie%20Run),r
Custard Cookie III & Strawberry Crepe Cookie (Cookie Run),13,/tags/Custard%20Cookie%20III%20*a*%20Strawberry%20Crepe%20Cookie%20(Cookie%20Run),r
Herb Cookie & Vampire Cookie (Cookie Run),10,/tags/Herb%20Cookie%20*a*%20Vampire%20Cookie%20(Cookie%20Run),r
Mentioned Dark Choco Cookie (Cookie Run),14,/tags/Mentioned%20Dark%20Choco%20Cookie%20(Cookie%20Run),f
Custard Cookie III & Pomegranate Cookie (Cookie Run),2,/tags/Custard%20Cookie%20III%20*a*%20Pomegranate%20Cookie%20(Cookie%20Run),r
Bottom Licorice Cookie (Cookie Run),8,/tags/Bottom%20Licorice%20Cookie%20(Cookie%20Run),f
Tower of Sweet Chaos (Cookie Run),18,/tags/Tower%20of%20Sweet%20Chaos%20(Cookie%20Run),f
Pilgrim Village (Cookie Run),2,/tags/Pilgrim%20Village%20(Cookie%20Run),f
Sands of Yogurca (Cookie Run),3,/tags/Sands%20of%20Yogurca%20(Cookie%20Run),f
Episode: e03 Hall of Enlightenment,0,/tags/Episode:%20e03%20Hall%20of%20Enlightenment,f
Cradle of Darkness Event (Cookie Run),0,/tags/Cradle%20of%20Darkness%20Event%20(Cookie%20Run),f
Cookies of Darkness (Cookie Run),76,/tags/Cookies%20of%20Darkness%20(Cookie%20Run),f
Sparkling Cookie's Juice Bar (Cookie Run),35,/tags/Sparkling%20Cookie's%20Juice%20Bar%20(Cookie%20Run),f
Cookie Run Characters Have Jam Instead of Blood,38,/tags/Cookie%20Run%20Characters%20Have%20Jam%20Instead%20of%20Blood,f
Sex in Cookie Form (Cookie Run),3,/tags/Sex%20in%20Cookie%20Form%20(Cookie%20Run),f
Trans Espresso Cookie (Cookie Run),33,/tags/Trans%20Espresso%20Cookie%20(Cookie%20Run),f
Blind Pure Vanilla Cookie (Cookie Run),33,/tags/Blind%20Pure%20Vanilla%20Cookie%20(Cookie%20Run),f
Episode: e10 Timeless Kingdom,0,/tags/Episode:%20e10%20Timeless%20Kingdom,f
Sleep Deprived Almond Cookie (Cookie Run),13,/tags/Sleep%20Deprived%20Almond%20Cookie%20(Cookie%20Run),f
Black Raisin Cookie/Raspberry Cookie (Cookie Run),4,/tags/Black%20Raisin%20Cookie*s*Raspberry%20Cookie%20(Cookie%20Run),r
Chocolate Bonbon Cookie/Captain Ice Cookie (Cookie Run),0,/tags/Chocolate%20Bonbon%20Cookie*s*Captain%20Ice%20Cookie%20(Cookie%20Run),r
Clover Cookie & Dark Choco Cookie (Cookie Run),0,/tags/Clover%20Cookie%20*a*%20Dark%20Choco%20Cookie%20(Cookie%20Run),r
Clover Cookie & Poison Mushroom Cookie (Cookie Run),0,/tags/Clover%20Cookie%20*a*%20Poison%20Mushroom%20Cookie%20(Cookie%20Run),r
Clover Cookie & Red Velvet Cookie (Cookie Run),2,/tags/Clover%20Cookie%20*a*%20Red%20Velvet%20Cookie%20(Cookie%20Run),r
Clover Cookie/Dark Choco Cookie (Cookie Run),2,/tags/Clover%20Cookie*s*Dark%20Choco%20Cookie%20(Cookie%20Run),r
Clover Cookie/Red Velvet Cookie (Cookie Run),7,/tags/Clover%20Cookie*s*Red%20Velvet%20Cookie%20(Cookie%20Run),r
Custard Cookie III/Pomegranate Cookie (Cookie Run),0,/tags/Custard%20Cookie%20III*s*Pomegranate%20Cookie%20(Cookie%20Run),r
Herb Cookie/Mint Choco Cookie/Sparkling Cookie/Vampire Cookie (Cookie Run),14,/tags/Herb%20Cookie*s*Mint%20Choco%20Cookie*s*Sparkling%20Cookie*s*Vampire%20Cookie%20(Cookie%20Run),r
Dino-Sour Cookie/Hero Cookie (Cookie Run),0,/tags/Dino-Sour%20Cookie*s*Hero%20Cookie%20(Cookie%20Run),r
Moon Rabbit Cookie & Pastry Cookie (Cookie Run),0,/tags/Moon%20Rabbit%20Cookie%20*a*%20Pastry%20Cookie%20(Cookie%20Run),r
Clover Cookie/Mint Choco Cookie (Cookie Run),4,/tags/Clover%20Cookie*s*Mint%20Choco%20Cookie%20(Cookie%20Run),r
Milk Cookie/Red Velvet Cookie (Cookie Run),3,/tags/Milk%20Cookie*s*Red%20Velvet%20Cookie%20(Cookie%20Run),r
Milk Cookie/Purple Yam Cookie/Red Velvet Cookie (Cookie Run),1,/tags/Milk%20Cookie*s*Purple%20Yam%20Cookie*s*Red%20Velvet%20Cookie%20(Cookie%20Run),r
Sparkling Cookie/Toothpaste Cookie (Cookie Run),0,/tags/Sparkling%20Cookie*s*Toothpaste%20Cookie%20(Cookie%20Run),r
Madeleine Cookie & Pancake Cookie (Cookie Run),1,/tags/Madeleine%20Cookie%20*a*%20Pancake%20Cookie%20(Cookie%20Run),r
Pomegranate Cookie/Sandwich Cookie (Cookie Run),0,/tags/Pomegranate%20Cookie*s*Sandwich%20Cookie%20(Cookie%20Run),r
Licorice Cookie/Milk Cookie (Cookie Run),1,/tags/Licorice%20Cookie*s*Milk%20Cookie%20(Cookie%20Run),r
Onion Cookie/Pure Vanilla Cookie (Cookie Run),0,/tags/Onion%20Cookie*s*Pure%20Vanilla%20Cookie%20(Cookie%20Run),r
Almond Cookie & Pumpkin Pie Cookie (Cookie Run),0,/tags/Almond%20Cookie%20*a*%20Pumpkin%20Pie%20Cookie%20(Cookie%20Run),r
Almond Cookie/Pumpkin Pie Cookie (Cookie Run),0,/tags/Almond%20Cookie*s*Pumpkin%20Pie%20Cookie%20(Cookie%20Run),r
Parfait Cookie/Twizzly Gummy Cookie (Cookie Run),12,/tags/Parfait%20Cookie*s*Twizzly%20Gummy%20Cookie%20(Cookie%20Run),r
Cinnamon Cookie & Wizard Cookie (Cookie Run),3,/tags/Cinnamon%20Cookie%20*a*%20Wizard%20Cookie%20(Cookie%20Run),r
Licorice Cookie/Sparkling Cookie/Vampire Cookie (Cookie Run),0,/tags/Licorice%20Cookie*s*Sparkling%20Cookie*s*Vampire%20Cookie%20(Cookie%20Run),r
Raspberry Cookie/Raspberry Mousse Cookie (Cookie Run),0,/tags/Raspberry%20Cookie*s*Raspberry%20Mousse%20Cookie%20(Cookie%20Run),r
Shining Glitter Cookie/Sour Belt Cookie (Cookie Run),3,/tags/Shining%20Glitter%20Cookie*s*Sour%20Belt%20Cookie%20(Cookie%20Run),r
Purple Yam Cookie/Red Velvet Cookie (Cookie Run),0,/tags/Purple%20Yam%20Cookie*s*Red%20Velvet%20Cookie%20(Cookie%20Run),r
Madeleine Cookie & Milk Cookie (Cookie Run),1,/tags/Madeleine%20Cookie%20*a*%20Milk%20Cookie%20(Cookie%20Run),r
Knight Cookie & Werewolf Cookie (Cookie Run),0,/tags/Knight%20Cookie%20*a*%20Werewolf%20Cookie%20(Cookie%20Run),r
Truffle Cookie (Cookie Run)/Original Female Character(s),0,/tags/Truffle%20Cookie%20(Cookie%20Run)*s*Original%20Female%20Character(s),r
Rockstar Cookie/Sparkling Cookie (Cookie Run),1,/tags/Rockstar%20Cookie*s*Sparkling%20Cookie%20(Cookie%20Run),r
Pistachio Cookie/Pitaya Dragon Cookie (Cookie Run),0,/tags/Pistachio%20Cookie*s*Pitaya%20Dragon%20Cookie%20(Cookie%20Run),r
Mala Sauce Cookie/Red Velvet Cookie (Cookie Run),0,/tags/Mala%20Sauce%20Cookie*s*Red%20Velvet%20Cookie%20(Cookie%20Run),r
Mala Sauce Cookie & Red Velvet Cookie (Cookie Run),0,/tags/Mala%20Sauce%20Cookie%20*a*%20Red%20Velvet%20Cookie%20(Cookie%20Run),r
Croissant Cookie & Strawberry Cookie (Cookie Run),0,/tags/Croissant%20Cookie%20*a*%20Strawberry%20Cookie%20(Cookie%20Run),r
Dark Choco Cookie (Cookie Run) & Original Character(s),3,/tags/Dark%20Choco%20Cookie%20(Cookie%20Run)%20*a*%20Original%20Character(s),r
Herb Cookie & Sparkling Cookie (Cookie Run),5,/tags/Herb%20Cookie%20*a*%20Sparkling%20Cookie%20(Cookie%20Run),r
Lilac Cookie/Plain Yogurt Cookie (Cookie Run),1,/tags/Lilac%20Cookie*s*Plain%20Yogurt%20Cookie%20(Cookie%20Run),r
Lime Cookie/Starfruit Cookie (Cookie Run),1,/tags/Lime%20Cookie*s*Starfruit%20Cookie%20(Cookie%20Run),r
Hollyberry Cookie (Cookie Run)/Original Character(s),2,/tags/Hollyberry%20Cookie%20(Cookie%20Run)*s*Original%20Character(s),r
Cookie Run Ensemble/Original Character(s),0,/tags/Cookie%20Run%20Ensemble*s*Original%20Character(s),r
Latte Cookie (Cookie Run)/Original Character(s),0,/tags/Latte%20Cookie%20(Cookie%20Run)*s*Original%20Character(s),r
Sea Fairy Cookie (Cookie Run)/Original Character(s),0,/tags/Sea%20Fairy%20Cookie%20(Cookie%20Run)*s*Original%20Character(s),r
   (Cookie Run)/Original Character(s),0,/tags/%F0%9D%96%A2%F0%9D%97%81%F0%9D%97%88%F0%9D%96%BC%F0%9D%97%88%F0%9D%97%85%F0%9D%96%BA%F0%9D%97%8D%F0%9D%96%BE%20%F0%9D%96%A1%F0%9D%97%88%F0%9D%97%87%F0%9D%96%BB%F0%9D%97%88%F0%9D%97%87%20%F0%9D%96%A2%F0%9D%97%88%F0%9D%97%88%F0%9D%97%84%F0%9D%97%82%F0%9D%96%BE%20(Cookie%20Run)*s*Original%20Character(s),r
Fig Cookie/Sparkling Cookie (Cookie Run),1,/tags/Fig%20Cookie*s*Sparkling%20Cookie%20(Cookie%20Run),r
Gumball Cookie/Soda Cookie (Cookie Run),15,/tags/Gumball%20Cookie*s*Soda%20Cookie%20(Cookie%20Run),r
Gumball Cookie & Soda Cookie (Cookie Run),9,/tags/Gumball%20Cookie%20*a*%20Soda%20Cookie%20(Cookie%20Run),r
Dark Choco Cookie/Latte Cookie (Cookie Run),2,/tags/Dark%20Choco%20Cookie*s*Latte%20Cookie%20(Cookie%20Run),r
Dark Cacao Cookie & Dark Choco Cookie (Cookie Run),86,/tags/Dark%20Cacao%20Cookie%20*a*%20Dark%20Choco%20Cookie%20(Cookie%20Run),r
Custard Cookie III & Dark Enchantress Cookie (Cookie Run),1,/tags/Custard%20Cookie%20III%20*a*%20Dark%20Enchantress%20Cookie%20(Cookie%20Run),r
Clover Cookie/Herb Cookie/Vampire Cookie (Cookie Run),2,/tags/Clover%20Cookie*s*Herb%20Cookie*s*Vampire%20Cookie%20(Cookie%20Run),r
Mint Choco Cookie & Sorbet Shark Cookie (Cookie Run),2,/tags/Mint%20Choco%20Cookie%20*a*%20Sorbet%20Shark%20Cookie%20(Cookie%20Run),r
Dragon's Tail (Cookie Run),1,/tags/Dragon's%20Tail%20(Cookie%20Run),c
Stink-Eye Tortuca (Cookie Run),4,/tags/Stink-Eye%20Tortuca%20(Cookie%20Run),c
Tranquil Bloom (Cookie Run),0,/tags/Tranquil%20Bloom%20(Cookie%20Run),c
Dark Choco Cookie & Pomegranate Cookie (Cookie Run),7,/tags/Dark%20Choco%20Cookie%20*a*%20Pomegranate%20Cookie%20(Cookie%20Run),r
Adventurer Cookie/Truffle Cookie (Cookie Run),0,/tags/Adventurer%20Cookie*s*Truffle%20Cookie%20(Cookie%20Run),r
Dragon's Tail/Knight Cookie (Cookie Run),0,/tags/Dragon's%20Tail*s*Knight%20Cookie%20(Cookie%20Run),r
