tag,count,href,category
Strawberry Crepe Cookie (Cookie Run) & Original Character(s),1,/tags/Strawberry%20Crepe%20Cookie%20(Cookie%20Run)%20*a*%20Original%20Character(s),r
Licorice Cookie/Pancake Cookie (Cookie Run),0,/tags/Licorice%20Cookie*s*Pancake%20Cookie%20(Cookie%20Run),r
Custard Cookie III/Licorice Cookie/Pancake Cookie (Cookie Run),0,/tags/Custard%20Cookie%20III*s*Licorice%20Cookie*s*Pancake%20Cookie%20(Cookie%20Run),r
Cream Puff Cookie/Moonlight Cookie/Sea Fairy Cookie (Cookie Run),0,/tags/Cream%20Puff%20Cookie*s*Moonlight%20Cookie*s*Sea%20Fairy%20Cookie%20(Cookie%20Run),r
Blueberry Pie Cookie/Cream Puff Cookie (Cookie Run),0,/tags/Blueberry%20Pie%20Cookie*s*Cream%20Puff%20Cookie%20(Cookie%20Run),r
Black Raisin Cookie/Parfait Cookie (Cookie Run),7,/tags/Black%20Raisin%20Cookie*s*Parfait%20Cookie%20(Cookie%20Run),r
Clover Cookie/Herb Cookie/Sparkling Cookie (Cookie Run),1,/tags/Clover%20Cookie*s*Herb%20Cookie*s*Sparkling%20Cookie%20(Cookie%20Run),r
Muscle Cookie/Spinach Cookie (Cookie Run),1,/tags/Muscle%20Cookie*s*Spinach%20Cookie%20(Cookie%20Run),r
Chess Choco Cookie/Earl Grey Cookie (Cookie Run),3,/tags/Chess%20Choco%20Cookie*s*Earl%20Grey%20Cookie%20(Cookie%20Run),r
Pizza Cookie (Cookie Run),27,/tags/Pizza%20Cookie%20(Cookie%20Run),c
Lilac Cookie/Whipped Cream Cookie (Cookie Run),1,/tags/Lilac%20Cookie*s*Whipped%20Cream%20Cookie%20(Cookie%20Run),r
Churro Cookie/Fire Spirit Cookie (Cookie Run),0,/tags/Churro%20Cookie*s*Fire%20Spirit%20Cookie%20(Cookie%20Run),r
Black Raisin Cookie/Pomegranate Cookie (Cookie Run),4,/tags/Black%20Raisin%20Cookie*s*Pomegranate%20Cookie%20(Cookie%20Run),r
Pumpkin Pie Cookie/Strawberry Cookie (Cookie Run),1,/tags/Pumpkin%20Pie%20Cookie*s*Strawberry%20Cookie%20(Cookie%20Run),r
Strawberry Crepe Cookie & Wizard Cookie (Cookie Run),2,/tags/Strawberry%20Crepe%20Cookie%20*a*%20Wizard%20Cookie%20(Cookie%20Run),r
Dark Cacao Kingdom (Cookie Run),24,/tags/Dark%20Cacao%20Kingdom%20(Cookie%20Run),f
Latte Cookie/Rye Cookie (Cookie Run),1,/tags/Latte%20Cookie*s*Rye%20Cookie%20(Cookie%20Run),r
Knight Cookie/Tiger Lily Cookie (Cookie Run),1,/tags/Knight%20Cookie*s*Tiger%20Lily%20Cookie%20(Cookie%20Run),r
Reverend Mother Cookie & Shadow Sister Cookie (Cookie Run),3,/tags/Reverend%20Mother%20Cookie%20*a*%20Shadow%20Sister%20Cookie%20(Cookie%20Run),r
Licorice Cookie/Yogurt Cream Cookie (Cookie Run),2,/tags/Licorice%20Cookie*s*Yogurt%20Cream%20Cookie%20(Cookie%20Run),r
Affogato Cookie & Caramel Arrow Cookie (Cookie Run),23,/tags/Affogato%20Cookie%20*a*%20Caramel%20Arrow%20Cookie%20(Cookie%20Run),r
Latte Cookie & Roguefort Cookie (Cookie Run),2,/tags/Latte%20Cookie%20*a*%20Roguefort%20Cookie%20(Cookie%20Run),r
Banana Cookie & Orange Cookie (Cookie Run),1,/tags/Banana%20Cookie%20*a*%20Orange%20Cookie%20(Cookie%20Run),r
Dr. Bones Cookie (Cookie Run),17,/tags/Dr*d*%20Bones%20Cookie%20(Cookie%20Run),c
Espresso Cookie & Hollyberry Cookie (Cookie Run),1,/tags/Espresso%20Cookie%20*a*%20Hollyberry%20Cookie%20(Cookie%20Run),r
Madeleine Cookie-centric (Cookie Run),7,/tags/Madeleine%20Cookie-centric%20(Cookie%20Run),f
Affogato Cookie/Knight Cookie (Cookie Run),0,/tags/Affogato%20Cookie*s*Knight%20Cookie%20(Cookie%20Run),r
Butter Pretzel Cookie/Truffle Cookie (Cookie Run),1,/tags/Butter%20Pretzel%20Cookie*s*Truffle%20Cookie%20(Cookie%20Run),r
Affogato Cookie/Espresso Cookie (Cookie Run),4,/tags/Affogato%20Cookie*s*Espresso%20Cookie%20(Cookie%20Run),r
Trans Vampire Cookie (Cookie Run),4,/tags/Trans%20Vampire%20Cookie%20(Cookie%20Run),f
Smile Detector (Cookie Run),1,/tags/Smile%20Detector%20(Cookie%20Run),c
Continuum Cog & Cosmos Gear (Cookie Run),1,/tags/Continuum%20Cog%20*a*%20Cosmos%20Gear%20(Cookie%20Run),r
Dark Choco Cookie (Cookie Run) & You,2,/tags/Dark%20Choco%20Cookie%20(Cookie%20Run)%20*a*%20You,r
Frost Queen Cookie/Lilac Cookie (Cookie Run),1,/tags/Frost%20Queen%20Cookie*s*Lilac%20Cookie%20(Cookie%20Run),r
Gumball Cookie/Wizard Cookie (Cookie Run),2,/tags/Gumball%20Cookie*s*Wizard%20Cookie%20(Cookie%20Run),r
Gumball Cookie & Wizard Cookie (Cookie Run),3,/tags/Gumball%20Cookie%20*a*%20Wizard%20Cookie%20(Cookie%20Run),r
Dark Cacao Cookie/Pure Vanilla Cookie/White Lily Cookie | Saint Lily Cookie,4,/tags/Dark%20Cacao%20Cookie*s*Pure%20Vanilla%20Cookie*s*White%20Lily%20Cookie%20%7C%20Saint%20Lily%20Cookie,r
Rambutan Cookie (Cookie Run),14,/tags/Rambutan%20Cookie%20(Cookie%20Run),c
Dark Choco Cookie & Werewolf Cookie (Cookie Run),1,/tags/Dark%20Choco%20Cookie%20*a*%20Werewolf%20Cookie%20(Cookie%20Run),r
Dark Cacao Cookie & Second Watcher (Cookie Run),9,/tags/Dark%20Cacao%20Cookie%20*a*%20Second%20Watcher%20(Cookie%20Run),r
Second Watcher (Cookie Run),35,/tags/Second%20Watcher%20(Cookie%20Run),c
Muscle Cookie & Ninja Cookie (Cookie Run),2,/tags/Muscle%20Cookie%20*a*%20Ninja%20Cookie%20(Cookie%20Run),r
Ninja Cookie & Red Pepper Cookie (Cookie Run),0,/tags/Ninja%20Cookie%20*a*%20Red%20Pepper%20Cookie%20(Cookie%20Run),r
Madeleine Cookie/Raspberry Cookie (Cookie Run),4,/tags/Madeleine%20Cookie*s*Raspberry%20Cookie%20(Cookie%20Run),r
Caramel Arrow Cookie/Espresso Cookie (Cookie Run),1,/tags/Caramel%20Arrow%20Cookie*s*Espresso%20Cookie%20(Cookie%20Run),r
Aloe Cookie/Licorice Cookie (Cookie Run),0,/tags/Aloe%20Cookie*s*Licorice%20Cookie%20(Cookie%20Run),r
Affogato Cookie (Cookie Run) & Original Character(s),9,/tags/Affogato%20Cookie%20(Cookie%20Run)%20*a*%20Original%20Character(s),r
Poison Mushroom Cookie/Squid Ink Cookie (Cookie Run),0,/tags/Poison%20Mushroom%20Cookie*s*Squid%20Ink%20Cookie%20(Cookie%20Run),r
Angel Cookie & Cream Puff Cookie (Cookie Run),0,/tags/Angel%20Cookie%20*a*%20Cream%20Puff%20Cookie%20(Cookie%20Run),r
Affogato Cookie (Cookie Run)/Everyone,0,/tags/Affogato%20Cookie%20(Cookie%20Run)*s*Everyone,r
Pomegranate Cookie (Cookie Run)/You,2,/tags/Pomegranate%20Cookie%20(Cookie%20Run)*s*You,r
Cream Puff Cookie & Madeleine Cookie (Cookie Run),2,/tags/Cream%20Puff%20Cookie%20*a*%20Madeleine%20Cookie%20(Cookie%20Run),r
Cocoa Cookie & Sparkling Cookie (Cookie Run),1,/tags/Cocoa%20Cookie%20*a*%20Sparkling%20Cookie%20(Cookie%20Run),r
Angel Cookie & Custard Cookie III (Cookie Run),0,/tags/Angel%20Cookie%20*a*%20Custard%20Cookie%20III%20(Cookie%20Run),r
Caramel Arrow Cookie & Dark Choco Cookie (Cookie Run),12,/tags/Caramel%20Arrow%20Cookie%20*a*%20Dark%20Choco%20Cookie%20(Cookie%20Run),r
Princess Cookie/Rye Cookie (Cookie Run),0,/tags/Princess%20Cookie*s*Rye%20Cookie%20(Cookie%20Run),r
Rye Cookie (Cookie Run)/You,2,/tags/Rye%20Cookie%20(Cookie%20Run)*s*You,r
Salt Cookie (Cookie Run)/You,1,/tags/Salt%20Cookie%20(Cookie%20Run)*s*You,r
Sea Fairy Cooke (Cookie Run)/You,0,/tags/Sea%20Fairy%20Cooke%20(Cookie%20Run)*s*You,r
Sparkling Cookie (Cookie Run)/You,0,/tags/Sparkling%20Cookie%20(Cookie%20Run)*s*You,r
Wind Archer Cookie (Cookie Run)/You,1,/tags/Wind%20Archer%20Cookie%20(Cookie%20Run)*s*You,r
Truffle Cookie (Cookie Run)/You,0,/tags/Truffle%20Cookie%20(Cookie%20Run)*s*You,r
Toothpaste Cookie (Cookie Run)/You,0,/tags/Toothpaste%20Cookie%20(Cookie%20Run)*s*You,r
Timekeeper Cookie (Cookie Run)/You,2,/tags/Timekeeper%20Cookie%20(Cookie%20Run)*s*You,r
Strawberry Crepe Cookie & Tiramisu Cookie (Cookie Run),1,/tags/Strawberry%20Crepe%20Cookie%20*a*%20Tiramisu%20Cookie%20(Cookie%20Run),r
Bumbleberry Cookie (Cookie Run) & Original Character(s),1,/tags/Bumbleberry%20Cookie%20(Cookie%20Run)%20*a*%20Original%20Character(s),r
Cream Unicorn Cookie & Whipped Cream Cookie (Cookie Run),2,/tags/Cream%20Unicorn%20Cookie%20*a*%20Whipped%20Cream%20Cookie%20(Cookie%20Run),r
Caramel Arrow Cookie/Pastry Cookie (Cookie Run),5,/tags/Caramel%20Arrow%20Cookie*s*Pastry%20Cookie%20(Cookie%20Run),r
Caramel Arrow Cookie & Pastry Cookie (Cookie Run),3,/tags/Caramel%20Arrow%20Cookie%20*a*%20Pastry%20Cookie%20(Cookie%20Run),r
Espresso Cookie & Princess Cookie (Cookie Run),2,/tags/Espresso%20Cookie%20*a*%20Princess%20Cookie%20(Cookie%20Run),r
Knight Cookie & Lychee Dragon Cookie (Cookie Run),1,/tags/Knight%20Cookie%20*a*%20Lychee%20Dragon%20Cookie%20(Cookie%20Run),r
Knight Cookie & Wizard Cookie (Cookie Run),2,/tags/Knight%20Cookie%20*a*%20Wizard%20Cookie%20(Cookie%20Run),r
Cherry Blossom Cookie & Hydrangea Cookie (Cookie Run),2,/tags/Cherry%20Blossom%20Cookie%20*a*%20Hydrangea%20Cookie%20(Cookie%20Run),r
Dark Choco Cookie & Pure Vanilla Cookie (Cookie Run),5,/tags/Dark%20Choco%20Cookie%20*a*%20Pure%20Vanilla%20Cookie%20(Cookie%20Run),r
Almond Cookie (Cookie Run)/Clay | Dream (Video Blogging RPF),0,/tags/Almond%20Cookie%20(Cookie%20Run)*s*Clay%20%7C%20Dream%20(Video%20Blogging%20RPF),r
Espresso Cookie & Vampire Cookie (Cookie Run),2,/tags/Espresso%20Cookie%20*a*%20Vampire%20Cookie%20(Cookie%20Run),r
Espresso Cookie (Cookie Run) & Swatch (Deltarune),1,/tags/Espresso%20Cookie%20(Cookie%20Run)%20*a*%20Swatch%20(Deltarune),r
Herb Cookie & Squid Ink Cookie (Cookie Run),1,/tags/Herb%20Cookie%20*a*%20Squid%20Ink%20Cookie%20(Cookie%20Run),r
Sea Fairy Cookie & Squid Ink Cookie (Cookie Run),3,/tags/Sea%20Fairy%20Cookie%20*a*%20Squid%20Ink%20Cookie%20(Cookie%20Run),r
Dom Espresso Cookie (Cookie Run),10,/tags/Dom%20Espresso%20Cookie%20(Cookie%20Run),f
Ruler of the Ephemeral Flow (Cookie Run),2,/tags/Ruler%20of%20the%20Ephemeral%20Flow%20(Cookie%20Run),c
Alchemist Cookie/Cinnamon Cookie (Cookie Run),0,/tags/Alchemist%20Cookie*s*Cinnamon%20Cookie%20(Cookie%20Run),r
Hanamura Teruteru/Vampire Cookie (Cookie Run),0,/tags/Hanamura%20Teruteru*s*Vampire%20Cookie%20(Cookie%20Run),r
Dark Cacao & Golden Cheese & Hollyberry & Pure Vanilla & White Lily | Saint Lily,15,/tags/Dark%20Cacao%20*a*%20Golden%20Cheese%20*a*%20Hollyberry%20*a*%20Pure%20Vanilla%20*a*%20White%20Lily%20%7C%20Saint%20Lily,r
Cotton Cookie (Cookie Run)/Original Character(s),1,/tags/Cotton%20Cookie%20(Cookie%20Run)*s*Original%20Character(s),r
Caramel Arrow Cookie/Dark Cacao Cookie (Cookie Run),11,/tags/Caramel%20Arrow%20Cookie*s*Dark%20Cacao%20Cookie%20(Cookie%20Run),r
Espresso Cookie & Pomegranate Cookie (Cookie Run),0,/tags/Espresso%20Cookie%20*a*%20Pomegranate%20Cookie%20(Cookie%20Run),r
Pastry Cookie & Pomegranate Cookie (Cookie Run),1,/tags/Pastry%20Cookie%20*a*%20Pomegranate%20Cookie%20(Cookie%20Run),r
Strawberry Jam Sword (Cookie Run),9,/tags/Strawberry%20Jam%20Sword%20(Cookie%20Run),c
Strawberry Jam Sword Does Not Control Dark Choco Cookie (Cookie Run),7,/tags/Strawberry%20Jam%20Sword%20Does%20Not%20Control%20Dark%20Choco%20Cookie%20(Cookie%20Run),f
Dark Choco Cookie Needs A Hug (Cookie Run),39,/tags/Dark%20Choco%20Cookie%20Needs%20A%20Hug%20(Cookie%20Run),f
Dark Choco Cookie Redemption (Cookie Run),10,/tags/Dark%20Choco%20Cookie%20Redemption%20(Cookie%20Run),f
Bad Parent Dark Cacao Cookie (Cookie Run),11,/tags/Bad%20Parent%20Dark%20Cacao%20Cookie%20(Cookie%20Run),f
Pure Vanilla Cookie is Custard Cookie III's Grandparent (Cookie Run),8,/tags/Pure%20Vanilla%20Cookie%20is%20Custard%20Cookie%20III's%20Grandparent%20(Cookie%20Run),f
Mentioned White Lily Cookie | Saint Lily Cookie,8,/tags/Mentioned%20White%20Lily%20Cookie%20%7C%20Saint%20Lily%20Cookie,f
Minor Espresso Cookie/Madeleine Cookie (Cookie Run),7,/tags/Minor%20Espresso%20Cookie*s*Madeleine%20Cookie%20(Cookie%20Run),f
Cocoa Cookie/Latte Cookie (Cookie Run),3,/tags/Cocoa%20Cookie*s*Latte%20Cookie%20(Cookie%20Run),r
Lesbian White Lily Cookie | Saint Lily Cookie,1,/tags/Lesbian%20White%20Lily%20Cookie%20%7C%20Saint%20Lily%20Cookie,f
Espresso Cookie and Latte Cookie are Cousins (Cookie Run),7,/tags/Espresso%20Cookie%20and%20Latte%20Cookie%20are%20Cousins%20(Cookie%20Run),f
Almond Cookie (Cookie Run)/Jeon Jungkook,0,/tags/Almond%20Cookie%20(Cookie%20Run)*s*Jeon%20Jungkook,r
Cherry Ball Cookie/Cocoa Cookie (Cookie Run),1,/tags/Cherry%20Ball%20Cookie*s*Cocoa%20Cookie%20(Cookie%20Run),r
Cherry Ball Cookie (Cookie Run),15,/tags/Cherry%20Ball%20Cookie%20(Cookie%20Run),c
Eclair Cookie/Mont Blanc Cookie (Cookie Run),0,/tags/Eclair%20Cookie*s*Mont%20Blanc%20Cookie%20(Cookie%20Run),r
Dread Trident of the Abyss (Cookie Run),1,/tags/Dread%20Trident%20of%20the%20Abyss%20(Cookie%20Run),c
Snow Sugar Cookie/Sorbet Shark Cookie (Cookie Run),1,/tags/Snow%20Sugar%20Cookie*s*Sorbet%20Shark%20Cookie%20(Cookie%20Run),r
Snow Sugar Cookie & Sorbet Shark Cookie (Cookie Run),1,/tags/Snow%20Sugar%20Cookie%20*a*%20Sorbet%20Shark%20Cookie%20(Cookie%20Run),r
Caramel Arrow Cookie/Madeleine Cookie (Cookie Run),1,/tags/Caramel%20Arrow%20Cookie*s*Madeleine%20Cookie%20(Cookie%20Run),r
Lilac Cookie & Sorbet Shark Cookie (Cookie Run),1,/tags/Lilac%20Cookie%20*a*%20Sorbet%20Shark%20Cookie%20(Cookie%20Run),r
Affogato Cookie/Madeleine Cookie (Cookie Run),1,/tags/Affogato%20Cookie*s*Madeleine%20Cookie%20(Cookie%20Run),r
Hollyberry Cookie (Cookie Run)/Original Female Character(s),1,/tags/Hollyberry%20Cookie%20(Cookie%20Run)*s*Original%20Female%20Character(s),r
Clotted Cream Cookie (Cookie Run),326,/tags/Clotted%20Cream%20Cookie%20(Cookie%20Run),c
Black Dragon (Cookie Run),5,/tags/Black%20Dragon%20(Cookie%20Run),c
White Dragon (Cookie Run),5,/tags/White%20Dragon%20(Cookie%20Run),c
Clay | Dream (Video Blogging RPF)/Vampire Cookie (Cookie Run),0,/tags/Clay%20%7C%20Dream%20(Video%20Blogging%20RPF)*s*Vampire%20Cookie%20(Cookie%20Run),r
Eclair Cookie/Lilac Cookie (Cookie Run),0,/tags/Eclair%20Cookie*s*Lilac%20Cookie%20(Cookie%20Run),r
Mala Sauce Cookie/Rambutan Cookie (Cookie Run),1,/tags/Mala%20Sauce%20Cookie*s*Rambutan%20Cookie%20(Cookie%20Run),r
Latte Cookie/Parfait Cookie/Raspberry Cookie/Timekeeper Cookie/Twizzly Gummy Cookie (Cookie Run),0,/tags/Latte%20Cookie*s*Parfait%20Cookie*s*Raspberry%20Cookie*s*Timekeeper%20Cookie*s*Twizzly%20Gummy%20Cookie%20(Cookie%20Run),r
Book of Wizdom (Cookie Run),2,/tags/Book%20of%20Wizdom%20(Cookie%20Run),c
Mini Jackson No. 2 (Cookie Run),2,/tags/Mini%20Jackson%20No*d*%202%20(Cookie%20Run),c
Rocket Firecracker (Cookie Run),1,/tags/Rocket%20Firecracker%20(Cookie%20Run),c
Oyster Cookie (Cookie Run),127,/tags/Oyster%20Cookie%20(Cookie%20Run),c
Dark Cacao Cookie (Cookie Run)/Original Female Character(s),5,/tags/Dark%20Cacao%20Cookie%20(Cookie%20Run)*s*Original%20Female%20Character(s),r
Crunchy Chip Cookie (Cookie Run),266,/tags/Crunchy%20Chip%20Cookie%20(Cookie%20Run),c
Vanilla Sugar Cookie (Cookie Run),22,/tags/Vanilla%20Sugar%20Cookie%20(Cookie%20Run),c
Mulled Juice Cookie (Cookie Run),40,/tags/Mulled%20Juice%20Cookie%20(Cookie%20Run),c
Baumkuchen Cookie (Cookie Run),26,/tags/Baumkuchen%20Cookie%20(Cookie%20Run),c
Mille-Feuille Cookie (Cookie Run),21,/tags/Mille-Feuille%20Cookie%20(Cookie%20Run),c
Canel Cookie (Cookie Run),18,/tags/Canel%C3%A9%20Cookie%20(Cookie%20Run),c
Sabl Cookie (Cookie Run),21,/tags/Sabl%C3%A9%20Cookie%20(Cookie%20Run),c
Captain Caviar Cookie (Cookie Run),146,/tags/Captain%20Caviar%20Cookie%20(Cookie%20Run),c
Raspberry Mousse Cookie (Cookie Run)/Original Character(s),1,/tags/Raspberry%20Mousse%20Cookie%20(Cookie%20Run)*s*Original%20Character(s),r
Clotted Cream Cookie/Mocha Cookie (Cookie Run),2,/tags/Clotted%20Cream%20Cookie*s*Mocha%20Cookie%20(Cookie%20Run),r
Soda Cookie & Sorbet Shark Cookie (Cookie Run),1,/tags/Soda%20Cookie%20*a*%20Sorbet%20Shark%20Cookie%20(Cookie%20Run),r
Roguefort Cookie & Timekeeper Cookie (Cookie Run),3,/tags/Roguefort%20Cookie%20*a*%20Timekeeper%20Cookie%20(Cookie%20Run),r
Black Raisin Cookie & Crowberry Cookie (Cookie Run),0,/tags/Black%20Raisin%20Cookie%20*a*%20Crowberry%20Cookie%20(Cookie%20Run),r
Black Raisin Cookie & Caramel Arrow Cookie (Cookie Run),3,/tags/Black%20Raisin%20Cookie%20*a*%20Caramel%20Arrow%20Cookie%20(Cookie%20Run),r
Financier Cookie (Cookie Run),184,/tags/Financier%20Cookie%20(Cookie%20Run),c
Affogato Cookie/Clotted Cream Cookie (Cookie Run),42,/tags/Affogato%20Cookie*s*Clotted%20Cream%20Cookie%20(Cookie%20Run),r
Red Velvet Cookie/Werewolf Cookie (Cookie Run),2,/tags/Red%20Velvet%20Cookie*s*Werewolf%20Cookie%20(Cookie%20Run),r
Almond Cookie/Clover Cookie (Cookie Run),2,/tags/Almond%20Cookie*s*Clover%20Cookie%20(Cookie%20Run),r
Caramel Arrow Cookie & Red Velvet Cookie (Cookie Run),2,/tags/Caramel%20Arrow%20Cookie%20*a*%20Red%20Velvet%20Cookie%20(Cookie%20Run),r
Dark Cacao Cookie & Hollyberry Cookie & Pure Vanilla Cookie (Cookie Run),15,/tags/Dark%20Cacao%20Cookie%20*a*%20Hollyberry%20Cookie%20*a*%20Pure%20Vanilla%20Cookie%20(Cookie%20Run),r
Caramel Arrow Cookie & Dark Cacao Cookie (Cookie Run),24,/tags/Caramel%20Arrow%20Cookie%20*a*%20Dark%20Cacao%20Cookie%20(Cookie%20Run),r
Crowberry Cookie & Moonlight Cookie (Cookie Run),1,/tags/Crowberry%20Cookie%20*a*%20Moonlight%20Cookie%20(Cookie%20Run),r
Dark Choco Cookie/Milk Cookie/Purple Yam Cookie (Cookie Run),2,/tags/Dark%20Choco%20Cookie*s*Milk%20Cookie*s*Purple%20Yam%20Cookie%20(Cookie%20Run),r
Affogato Cookie & Latte Cookie (Cookie Run),3,/tags/Affogato%20Cookie%20*a*%20Latte%20Cookie%20(Cookie%20Run),r
Dark Enchantress Cookie Doesn't Exist (Cookie Run),3,/tags/Dark%20Enchantress%20Cookie%20Doesn't%20Exist%20(Cookie%20Run),f
Dark Cacao Cookie & Licorice Cookie (Cookie Run),2,/tags/Dark%20Cacao%20Cookie%20*a*%20Licorice%20Cookie%20(Cookie%20Run),r
Latte Cookie & Pastry Cookie (Cookie Run),3,/tags/Latte%20Cookie%20*a*%20Pastry%20Cookie%20(Cookie%20Run),r
Aloe Cookie & Licorice Cookie (Cookie Run),0,/tags/Aloe%20Cookie%20*a*%20Licorice%20Cookie%20(Cookie%20Run),r
Lilac Cookie & Plain Yogurt Cookie (Cookie Run),2,/tags/Lilac%20Cookie%20*a*%20Plain%20Yogurt%20Cookie%20(Cookie%20Run),r
Choco Ball Cookie (Cookie Run),14,/tags/Choco%20Ball%20Cookie%20(Cookie%20Run),c
Cookiedroid/Pink Choco Cookie (Cookie Run),1,/tags/Cookiedroid*s*Pink%20Choco%20Cookie%20(Cookie%20Run),r
Candlelight Cookie & Crowberry Cookie (Cookie Run),2,/tags/Candlelight%20Cookie%20*a*%20Crowberry%20Cookie%20(Cookie%20Run),r
Financier Cookie/Pastry Cookie (Cookie Run),2,/tags/Financier%20Cookie*s*Pastry%20Cookie%20(Cookie%20Run),r
Cherry Ball Cookie/Choco Ball Cookie (Cookie Run),5,/tags/Cherry%20Ball%20Cookie*s*Choco%20Ball%20Cookie%20(Cookie%20Run),r
Cherry Blossom Cookie/Herb Cookie (Cookie Run),2,/tags/Cherry%20Blossom%20Cookie*s*Herb%20Cookie%20(Cookie%20Run),r
Cherry Blossom/Sparkling Cookie (Cookie Run),0,/tags/Cherry%20Blossom*s*Sparkling%20Cookie%20(Cookie%20Run),r
Cherry Blossom Cookie/Herb Cookie/Sparkling Cookie (Cookie Run),0,/tags/Cherry%20Blossom%20Cookie*s*Herb%20Cookie*s*Sparkling%20Cookie%20(Cookie%20Run),r
Bottom Clotted Cream Cookie (Cookie Run),2,/tags/Bottom%20Clotted%20Cream%20Cookie%20(Cookie%20Run),f
Clotted Cream Cookie & Financier Cookie (Cookie Run),29,/tags/Clotted%20Cream%20Cookie%20*a*%20Financier%20Cookie%20(Cookie%20Run),r
Cream Puff Cookie & Pumpkin Pie Cookie (Cookie Run),0,/tags/Cream%20Puff%20Cookie%20*a*%20Pumpkin%20Pie%20Cookie%20(Cookie%20Run),r
Cotton Cookie & Cream Puff Cookie (Cookie Run),0,/tags/Cotton%20Cookie%20*a*%20Cream%20Puff%20Cookie%20(Cookie%20Run),r
Cotton Cookie & Strawberry Crepe Cookie (Cookie Run),0,/tags/Cotton%20Cookie%20*a*%20Strawberry%20Crepe%20Cookie%20(Cookie%20Run),r
Pumpkin Pie Cookie & Strawberry Crepe Cookie (Cookie Run),1,/tags/Pumpkin%20Pie%20Cookie%20*a*%20Strawberry%20Crepe%20Cookie%20(Cookie%20Run),r
GingerBrave | Brave Cookie Angst,14,/tags/GingerBrave%20%7C%20Brave%20Cookie%20Angst,f
Custard Cookie III & Dozer Cookie (Cookie Run),0,/tags/Custard%20Cookie%20III%20*a*%20Dozer%20Cookie%20(Cookie%20Run),r
Wild Strawberry Cookie | Original Wildberry Cookie,4,/tags/Wild%20Strawberry%20Cookie%20%7C%20Original%20Wildberry%20Cookie,c
Wildberry Cookie | Hollyberry Cookie's Bodyguard (Cookie Run),231,/tags/Wildberry%20Cookie%20%7C%20Hollyberry%20Cookie's%20Bodyguard%20(Cookie%20Run),c
Time Balance Department Employees (Cookie Run),5,/tags/Time%20Balance%20Department%20Employees%20(Cookie%20Run),c
Loki (Marvel) & Time Balance Department Employees (Cookie Run),0,/tags/Loki%20(Marvel)%20*a*%20Time%20Balance%20Department%20Employees%20(Cookie%20Run),r
Hero Cookie is Called Caramel (Cookie Run),0,/tags/Hero%20Cookie%20is%20Called%20Caramel%20(Cookie%20Run),f
Bottom Espresso Cookie (Cookie Run),8,/tags/Bottom%20Espresso%20Cookie%20(Cookie%20Run),f
Espresso Cookie Has a Bad Time (Cookie Run),13,/tags/Espresso%20Cookie%20Has%20a%20Bad%20Time%20(Cookie%20Run),f
Espresso Cookie & Latte Cookie Friendship (Cookie Run),1,/tags/Espresso%20Cookie%20*a*%20Latte%20Cookie%20Friendship%20(Cookie%20Run),f
Minor Almond Cookie/Latte Cookie (Cookie Run),2,/tags/Minor%20Almond%20Cookie*s*Latte%20Cookie%20(Cookie%20Run),f
Earl Grey Cookie and Roguefort Cookie are Siblings (Cookie Run),2,/tags/Earl%20Grey%20Cookie%20and%20Roguefort%20Cookie%20are%20Siblings%20(Cookie%20Run),f
Dark Enchantress Cookie Adopts Red Velvet Cookie (Cookie Run),12,/tags/Dark%20Enchantress%20Cookie%20Adopts%20Red%20Velvet%20Cookie%20(Cookie%20Run),f
Dark Enchantress Cookie is Red Velvet Cookie's Parent (Cookie Run),25,/tags/Dark%20Enchantress%20Cookie%20is%20Red%20Velvet%20Cookie's%20Parent%20(Cookie%20Run),f
Bottom Yogurt Cream Cookie (Cookie Run),2,/tags/Bottom%20Yogurt%20Cream%20Cookie%20(Cookie%20Run),f
Bottom Lilac Cookie (Cookie Run),4,/tags/Bottom%20Lilac%20Cookie%20(Cookie%20Run),f
Angel Cookie/GingerBright | Bright Cookie/Strawberry Cookie,1,/tags/Angel%20Cookie*s*GingerBright%20%7C%20Bright%20Cookie*s*Strawberry%20Cookie,r
Madeleine Cookie/Werewolf Cookie (Cookie Run),0,/tags/Madeleine%20Cookie*s*Werewolf%20Cookie%20(Cookie%20Run),r
Espresso Cookie/Rye Cookie (Cookie Run),1,/tags/Espresso%20Cookie*s*Rye%20Cookie%20(Cookie%20Run),r
Cocoa Cookie/Latte Cookie/Raspberry Cookie (Cookie Run),3,/tags/Cocoa%20Cookie*s*Latte%20Cookie*s*Raspberry%20Cookie%20(Cookie%20Run),r
Lilac Cookie / Princess Cookie (Cookie Run),1,/tags/Lilac%20Cookie%20*s*%20Princess%20Cookie%20(Cookie%20Run),r
Song: Everything You Need (Cookie Run),0,/tags/Song:%20Everything%20You%20Need%20(Cookie%20Run),f
Soda Cookie/Sparkling Cookie (Cookie Run),1,/tags/Soda%20Cookie*s*Sparkling%20Cookie%20(Cookie%20Run),r
Host Cookie (Cookie Run),1,/tags/Host%20Cookie%20(Cookie%20Run),c
Nini | Milk (Food Fantasy)/Whipped Cream Cookie (Cookie Run),0,/tags/Ni%C3%BAn%C7%8Ei%20%7C%20Milk%20(Food%20Fantasy)*s*Whipped%20Cream%20Cookie%20(Cookie%20Run),r
Affogato Cookie/Lilac Cookie (Cookie Run),1,/tags/Affogato%20Cookie*s*Lilac%20Cookie%20(Cookie%20Run),r
Mint Choco Cookie & Sparkling Cookie (Cookie Run),4,/tags/Mint%20Choco%20Cookie%20*a*%20Sparkling%20Cookie%20(Cookie%20Run),r
Mentioned Madeleine Cookie (Cookie Run),6,/tags/Mentioned%20Madeleine%20Cookie%20(Cookie%20Run),f
Dark Choco Cookie & White Lily Cookie | Saint Lily Cookie,6,/tags/Dark%20Choco%20Cookie%20*a*%20White%20Lily%20Cookie%20%7C%20Saint%20Lily%20Cookie,r
Clotted Cream Cookie/Vampire Cookie (Cookie Run),1,/tags/Clotted%20Cream%20Cookie*s*Vampire%20Cookie%20(Cookie%20Run),r
Chili Pepper Cookie/Pomegranate Cookie (Cookie Run),1,/tags/Chili%20Pepper%20Cookie*s*Pomegranate%20Cookie%20(Cookie%20Run),r
Popping Candy Cookie & Spearmint Cookie (Cookie Run),1,/tags/Popping%20Candy%20Cookie%20*a*%20Spearmint%20Cookie%20(Cookie%20Run),r
Trans Latte Cookie (Cookie Run),2,/tags/Trans%20Latte%20Cookie%20(Cookie%20Run),f
Dark Enchantress Cookie & Squid Ink Cookie (Cookie Run),0,/tags/Dark%20Enchantress%20Cookie%20*a*%20Squid%20Ink%20Cookie%20(Cookie%20Run),r
Licorice Cookie & Squid Ink Cookie (Cookie Run),0,/tags/Licorice%20Cookie%20*a*%20Squid%20Ink%20Cookie%20(Cookie%20Run),r
Pomegranate Cookie & Squid Ink Cookie (Cookie Run),0,/tags/Pomegranate%20Cookie%20*a*%20Squid%20Ink%20Cookie%20(Cookie%20Run),r
Poison Mushroom Cookie & Squid Ink Cookie (Cookie Run),0,/tags/Poison%20Mushroom%20Cookie%20*a*%20Squid%20Ink%20Cookie%20(Cookie%20Run),r
Earl Grey Cookie Cookie & Squid Ink Cookie (Cookie Run),0,/tags/Earl%20Grey%20Cookie%20Cookie%20*a*%20Squid%20Ink%20Cookie%20(Cookie%20Run),r
Lobster Cookie & Squid Ink Cookie (Cookie Run),0,/tags/Lobster%20Cookie%20*a*%20Squid%20Ink%20Cookie%20(Cookie%20Run),r
Crunchy Chip Cookie/Red Velvet Cookie (Cookie Run),10,/tags/Crunchy%20Chip%20Cookie*s*Red%20Velvet%20Cookie%20(Cookie%20Run),r
Chiffon/Pastry Cookie (Cookie Run),0,/tags/Chiffon*s*Pastry%20Cookie%20(Cookie%20Run),r
Choco Werehound Brute | Schwarzwlder/Pastry Cookie,1,/tags/Choco%20Werehound%20Brute%20%7C%20Schwarzw%C3%A4lder*s*Pastry%20Cookie,r
Cakeberus/Pastry Cookie (Cookie Run),0,/tags/Cakeberus*s*Pastry%20Cookie%20(Cookie%20Run),r
Crunchy Chip Cookie & Red Velvet Cookie (Cookie Run),3,/tags/Crunchy%20Chip%20Cookie%20*a*%20Red%20Velvet%20Cookie%20(Cookie%20Run),r
Cookie Run Pride Month,1,/tags/Cookie%20Run%20Pride%20Month,f
Pastry Cookie/Shadow Sister Cookie (Cookie Run),1,/tags/Pastry%20Cookie*s*Shadow%20Sister%20Cookie%20(Cookie%20Run),r
Espresso Cookie/Wizard Cookie (Cookie Run),1,/tags/Espresso%20Cookie*s*Wizard%20Cookie%20(Cookie%20Run),r
Pastry Cookie & Shadow Sister Cookie (Cookie Run),1,/tags/Pastry%20Cookie%20*a*%20Shadow%20Sister%20Cookie%20(Cookie%20Run),r
Lilac Cookie & Timekeeper Cookie (Cookie Run),1,/tags/Lilac%20Cookie%20*a*%20Timekeeper%20Cookie%20(Cookie%20Run),r
Affogato Cookie/Licorice Cookie (Cookie Run),10,/tags/Affogato%20Cookie*s*Licorice%20Cookie%20(Cookie%20Run),r
Clover Cookie & Sonic Cookie (Cookie Run),1,/tags/Clover%20Cookie%20*a*%20Sonic%20Cookie%20(Cookie%20Run),r
Moon Rabbit Cookie & Pumpkin Pie Cookie (Cookie Run),1,/tags/Moon%20Rabbit%20Cookie%20*a*%20Pumpkin%20Pie%20Cookie%20(Cookie%20Run),r
Cherry Blossom Cookie & Cherry Cookie (Cookie Run),2,/tags/Cherry%20Blossom%20Cookie%20*a*%20Cherry%20Cookie%20(Cookie%20Run),r
Dark Choco Cookie & Madeleine Cookie & Red Velvet Cookie (Cookie Run),1,/tags/Dark%20Choco%20Cookie%20*a*%20Madeleine%20Cookie%20*a*%20Red%20Velvet%20Cookie%20(Cookie%20Run),r
Adventurer Cookie (Cookie Run)/Original Character(s),1,/tags/Adventurer%20Cookie%20(Cookie%20Run)*s*Original%20Character(s),r
Purple Yam Cookie & Strawberry Cookie (Cookie Run),6,/tags/Purple%20Yam%20Cookie%20*a*%20Strawberry%20Cookie%20(Cookie%20Run),r
Dark Choco Cookie & Strawberry Cookie (Cookie Run),2,/tags/Dark%20Choco%20Cookie%20*a*%20Strawberry%20Cookie%20(Cookie%20Run),r
Alchemist Cookie/Herb Cookie (Cookie Run),2,/tags/Alchemist%20Cookie*s*Herb%20Cookie%20(Cookie%20Run),r
